aka,aspect_ratio,budget,cast,certificate,color,country,cumulative_gross,director,duration,filming_locations,genres,gross_usa,keywords,language,opening_weekend_usa,poster,rating,rating_count,release_date,sound_mix,stars,storyline,summary,title,url,writers,year_release
Rita Hayworth and Shawshank Redemption,1.85 : 1,25000000,"Tim Robbins,Morgan Freeman,Bob Gunton,William Sadler,Clancy Brown,Gil Bellows,Mark Rolston,James Whitmore,Jeffrey DeMunn,Larry Brandenburg,Neil Giuntoli,Brian Libby,David Proval,Joseph Ragno,Jude Ciccolella",R,Color,USA,28817291,Frank Darabont,2h 22min,"Sandy Point, St. Croix, U.S. Virgin Islands",Drama,28699976,"wrongful imprisonment,based on the works of stephen king,prison,escape from prison,voice over narration",English,727327,/title/tt0111161/mediaviewer/rm10105600,9.3,2383509,14 October 1994 (USA),Dolby Digital,"Tim Robbins,Morgan Freeman,Bob Gunton","Chronicles the experiences of a formerly successful banker as a prisoner in the gloomy jailhouse of Shawshank after being found guilty of a crime he did not commit. The film portrays the man's unique way of dealing with his new, torturous life; along the way he befriends a number of fellow prisoners, most notably a wise long-term inmate named Red.","Two imprisoned men bond over a number of years, finding solace and eventual redemption through acts of common decency.",The Shawshank Redemption,https://www.imdb.com/title/tt0111161/,"Stephen King,Frank Darabont",1994
The Gladiators,2.39 : 1,103000000,"Russell Crowe,Joaquin Phoenix,Connie Nielsen,Oliver Reed,Richard Harris,Derek Jacobi,Djimon Hounsou,David Schofield,John Shrapnel,Tomas Arana,Ralf Moeller,Spencer Treat Clark,David Hemmings,Tommy Flanagan,Sven-Ole Thorsen",R,Color,USA,465364545,Ridley Scott,2h 35min,Morocco,"Action,Adventure,Drama",187705427,"roman empire,slavery,combat,battlefield,mother son relationship",English,34819017,/title/tt0172495/mediaviewer/rm2442542592,8.5,1361913,5 May 2000 (USA),SDDS,"Russell Crowe,Joaquin Phoenix,Connie Nielsen","Maximus is a powerful Roman general, loved by the people and the aging Emperor, Marcus Aurelius. Before his death, the Emperor chooses Maximus to be his heir over his own son, Commodus, and a power struggle leaves Maximus and his family condemned to death. The powerful general is unable to save his family, and his loss of will allows him to get captured and put into the Gladiator games until he dies. The only desire that fuels him now is the chance to rise to the top so that he will be able to look into the eyes of the man who will feel his revenge.",A former Roman General sets out to exact vengeance against the corrupt emperor who murdered his family and sent him into slavery.,Gladiator,https://www.imdb.com/title/tt0172495/,"David Franzoni,David Franzoni,2 more credits",2000
The Masses,1.37 : 1,1500000,"Charles Chaplin,Paulette Goddard,Henry Bergman,Tiny Sandford,Chester Conklin,Hank Mann,Stanley Blystone,Al Ernest Garcia,Richard Alexander,Cecil Reynolds,Mira McKinney,Murdock MacQuarrie,Wilfred Lucas,Edward LeSaint,Fred Malatesta",G,Black and White,USA,457688,Charles Chaplin,1h 27min,"Santa Clarita, California, USA","Comedy,Drama,Family,Romance",163577,"jail,actor director writer,music score composed by director,factory,satire",English,35809,/title/tt0027977/mediaviewer/rm1482701312,8.5,221970,25 February 1936 (USA),Mono,"Charles Chaplin,Paulette Goddard,Henry Bergman","Chaplin's last 'silent' film, filled with sound effects, was made when everyone else was making talkies. Charlie turns against modern society, the machine age, (The use of sound in films ?) and progress. Firstly we see him frantically trying to keep up with a production line, tightening bolts. He is selected for an experiment with an automatic feeding machine, but various mishaps leads his boss to believe he has gone mad, and Charlie is sent to a mental hospital - When he gets out, he is mistaken for a communist while waving a red flag, sent to jail, foils a jailbreak, and is let out again. We follow Charlie through many more escapades before the film is out.",The Tramp struggles to live in modern industrial society with the help of a young homeless woman.,Modern Times,https://www.imdb.com/title/tt0027977/,Charles Chaplin,1936
American History X,1.85 : 1,20000000,"Edward Norton,Edward Furlong,Beverly D'Angelo,Jennifer Lien,Ethan Suplee,Fairuza Balk,Avery Brooks,Elliott Gould,Stacy Keach,William Russ,Guy Torry,Joe Cortese,Jason Bose Smith,Antonio David Lyons,Alex Sol",R,Color,USA,23875127,Tony Kaye,1h 59min,"2206 Meade Place, Venice Beach, Los Angeles, California, USA",Drama,6719864,"neo nazi,prison,hatred,racism,jail",English,156076,/title/tt0120586/mediaviewer/rm15519489,8.5,1047103,20 November 1998 (USA),SDDS,"Edward Norton,Edward Furlong,Beverly D'Angelo","Derek Vineyard is paroled after serving 3 years in prison for brutally killing two black men who tried to break into/steal his truck. Through his brother's, Danny Vineyard, narration, we learn that before going to prison, Derek was a skinhead and the leader of a violent white supremacist gang that committed acts of racial crime throughout L.A. and his actions greatly influenced Danny. Reformed and fresh out of prison, Derek severs contact with the gang and becomes determined to keep Danny from going down the same violent path as he did.",A former neo-nazi skinhead tries to prevent his younger brother from going down the same wrong path that he did.,American History X,https://www.imdb.com/title/tt0120586/,David McKenna,1998
Back to the Future,1.37 : 1,19000000,"Michael J. Fox,Christopher Lloyd,Lea Thompson,Crispin Glover,Thomas F. Wilson,Claudia Wells,Marc McClure,Wendie Jo Sperber,George DiCenzo,Frances Lee McCain,James Tolkan,J.J. Cohen,Casey Siemaszko,Billy Zane,Harry Waters Jr.",PG,Color,USA,381906762,Robert Zemeckis,1h 56min,"Santa Clarita, California, USA","Adventure,Comedy,Sci-Fi",211406762,"time travel,delorean,time machine,future,time travel comedy",English,11152500,/title/tt0088763/mediaviewer/rm554638848,8.5,1077561,3 July 1985 (USA),70 mm 6-Track,"Michael J. Fox,Christopher Lloyd,Lea Thompson","Marty McFly, a typical American teenager of the Eighties, is accidentally sent back to 1955 in a plutonium-powered DeLorean ""time machine"" invented by a slightly mad scientist. During his often hysterical, always amazing trip back in time, Marty must make certain his teenage parents-to-be meet and fall in love - so he can get back to the future.","Marty McFly, a 17-year-old high school student, is accidentally sent thirty years into the past in a time-traveling DeLorean invented by his close friend, the eccentric scientist Doc Brown.",Back to the Future,https://www.imdb.com/title/tt0088763/,"Robert Zemeckis,Bob Gale",1985
Terminator 2: Judgment Day,2.39 : 1,102000000,"Arnold Schwarzenegger,Linda Hamilton,Edward Furlong,Robert Patrick,Earl Boen,Joe Morton,S. Epatha Merkerson,Castulo Guerra,Danny Cooksey,Jenette Goldstein,Xander Berkeley,Leslie Hamilton Gearren,Ken Gibbel,Robert Winley,Peter Schrum",R,Color,USA,520881154,James Cameron,2h 17min,"Santa Clarita, California, USA","Action,Sci-Fi",205881154,"time travel,future,sequel,artificial intelligence,mother son relationship",English,31765506,/title/tt0103064/mediaviewer/rm1982141440,8.5,1008137,3 July 1991 (USA),70 mm 6-Track,"Arnold Schwarzenegger,Linda Hamilton,Edward Furlong","Over 10 years have passed since the first machine called The Terminator tried to kill Sarah Connor and her unborn son, John. The man who will become the future leader of the human resistance against the Machines is now a healthy young boy. However, another Terminator, called the T-1000, is sent back through time by the supercomputer Skynet. This new Terminator is more advanced and more powerful than its predecessor and its mission is to kill John Connor when he's still a child. However, in the Internet and John do not have to face the threat of the T-1000 alone. Another Terminator (identical to the same model that tried and failed to kill Sarah Connor in 1984) is also sent back through time to protect them. Now, the battle for tomorrow has begun.","A cyborg, identical to the one who failed to kill Sarah Connor, must now protect her ten year old son, John Connor, from a more advanced and powerful cyborg.",Terminator 2: Judgment Day,https://www.imdb.com/title/tt0103064/,"James Cameron,William Wisher",1991
The Pianist,1.85 : 1,35000000,"Adrien Brody,Emilia Fox,Michal Zebrowski,Ed Stoppard,Maureen Lipman,Frank Finlay,Jessica Kate Meyer,Julia Rayner,Wanja Mues,Richard Ridings,Nomi Sharron,Anthony Milner,Lucy Skeaping,Roddy Skeaping,Ben Harlan",R,Color,UK,120072577,Roman Polanski,2h 30min,Germany,"Biography,Drama,Music,War",32572577,"pianist,holocaust,survival,poland,nazi occupied poland",English,111261,/title/tt0253474/mediaviewer/rm902038272,8.5,745561,28 March 2003 (USA),DTS,"Adrien Brody,Thomas Kretschmann,Frank Finlay","In this adaptation of the autobiography ""The Pianist: The Extraordinary True Story of One Man's Survival in Warsaw, 1939-1945,""",A Polish Jewish musician struggles to survive the destruction of the Warsaw ghetto of World War II.,The Pianist,https://www.imdb.com/title/tt0253474/,"Ronald Harwood,Wladyslaw Szpilman",2002
The Usual Suspects,2.39 : 1,6000000,"Stephen Baldwin,Gabriel Byrne,Benicio Del Toro,Kevin Pollak,Kevin Spacey,Chazz Palminteri,Pete Postlethwaite,Suzy Amis,Giancarlo Esposito,Dan Hedaya,Paul Bartel,Carl Bressler,Phillipe Simon,Jack Shearer,Christine Estabrook",R,Color,USA,23341568,Bryan Singer,1h 46min,"Los Angeles, California, USA","Crime,Mystery,Thriller",23341568,"surprise ending,criminal mastermind,criminal,suspect,unreliable narrator",English,645363,/title/tt0114814/mediaviewer/rm1975465472,8.5,1004790,16 August 1995 (USA),Dolby SR,"Kevin Spacey,Gabriel Byrne,Chazz Palminteri","Following a truck hijack in New York, five criminals are arrested and brought together for questioning. As none of them are guilty, they plan a revenge operation against the police. The operation goes well, but then the influence of a legendary mastermind criminal called Keyser Söze is felt. It becomes clear that each one of them has wronged Söze at some point and must pay back now. The payback job leaves 27 men dead in a boat explosion, but the real question arises now: Who actually is Keyser Söze?","A sole survivor tells of the twisty events leading up to a horrific gun battle on a boat, which began when five criminals met at a seemingly random police lineup.",The Usual Suspects,https://www.imdb.com/title/tt0114814/,Christopher McQuarrie,1995
The Lion King 3D,1.85 : 1,45000000,"Rowan Atkinson,Matthew Broderick,Niketa Calame-Harris,Jim Cummings,Whoopi Goldberg,Robert Guillaume,Jeremy Irons,James Earl Jones,Moira Kelly,Nathan Lane,Zoe Leader,Cheech Marin,Ernie Sabella,Madge Sinclair,Jonathan Taylor Thomas",G,Color,USA,1083720877,Roger Allers,1h 28min,"Walt Disney Studios Motion Pictures - 500 S. Buena Vista Street, Burbank, California, USA","Animation,Adventure,Drama,Family,Musical",422783777,"africa,king,lion,prince,disney",English,1586753,/title/tt0110357/mediaviewer/rm3272938240,8.5,958284,24 June 1994 (USA),Dolby SR,"Matthew Broderick,Jeremy Irons,James Earl Jones","A young lion prince is cast out of his pride by his cruel uncle, who claims he killed his father. While the uncle rules with an iron paw, the prince grows up beyond the Savannah, living by a philosophy: No worries for the rest of your days. But when his past comes to haunt him, the young prince must decide his fate: Will he remain an outcast or face his demons and become what he needs to be?","Lion prince Simba and his father are targeted by his bitter uncle, who wants to ascend the throne himself.",The Lion King,https://www.imdb.com/title/tt0110357/,"Irene Mecchi,Jonathan Roberts,27 more credits",1994
Hara-Kiri,2.35 : 1,,"Tatsuya Nakadai,Akira Ishihama,Shima Iwashita,Tetsurô Tanba,Masao Mishima,Ichirô Nakatani,Kei Satô,Yoshio Inaba,Hisashi Igawa,Tôru Takeuchi,Yoshirô Aoki,Tatsuo Matsumura,Akiji Kobayashi,Kôichi Hayashi,Ryûtarô Gomi",Not Rated,Black and White,Japan,15222,Masaki Kobayashi,2h 13min,"Kyoto, Kyoto, Japan","Action,Drama,Mystery",,"samurai,suicide,poverty,revenge,one against many",Japanese,,/title/tt0056058/mediaviewer/rm3238815744,8.6,44572,4 August 1964 (USA),Mono,"Tatsuya Nakadai,Akira Ishihama,Shima Iwashita","Peace in 17th-century Japan causes the Shogunate's breakup of warrior clans, throwing thousands of samurai out of work and into poverty. An honorable end to such fate under the samurai code is ritual suicide, or hara-kiri (self-inflicted disembowelment). An elder warrior, Hanshiro Tsugumo (Tatsuya Nakadai) seeks admittance to the house of a feudal lord to commit the act. There, he learns of the fate of his son-in-law, a young samurai who sought work at the house but was instead barbarically forced to commit traditional hara-kiri in an excruciating manner with a dull bamboo blade. In flashbacks the samurai tells the tragic story of his son-in-law, and how he was forced to sell his real sword to support his sick wife and child. Tsugumo thus sets in motion a tense showdown of revenge against the house.","When a ronin requesting seppuku at a feudal lord's palace is told of the brutal suicide of another ronin who previously visited, he reveals how their pasts are intertwined - and in doing so challenges the clan's integrity.",Hara-Kiri,https://www.imdb.com/title/tt0056058/,"Yasuhiko Takiguchi,Shinobu Hashimoto",1962
Léon: The Professional,2.39 : 1,"FRF115,000,000","Jean Reno,Gary Oldman,Natalie Portman,Danny Aiello,Peter Appel,Willi One Blood,Don Creech,Keith A. Glascoe,Randolph Scott,Michael Badalucco,Ellen Greene,Elizabeth Regen,Carl J. Matusovich,Frank Senger,Lucius Wyatt Cherokee",R,Color,France,19552639,Luc Besson,1h 50min,"7th Avenue and W 54th Street, New York City, New York, USA","Action,Crime,Drama,Thriller",19501238,"girl,hitman,teenage girl,older man young girl relationship,neo noir",English,5306558,/title/tt0110413/mediaviewer/rm72749056,8.5,1052743,18 November 1994 (USA),Dolby Digital,"Jean Reno,Gary Oldman,Natalie Portman","After her father, step-mother, step-sister and little brother are killed by her father's employers, the 12-year-old daughter of an abject drug dealer manages to take refuge in the apartment of a professional hitman who at her request teaches her the methods of his job so she can take her revenge on the corrupt DEA agent who ruined her life by killing her beloved brother.","Mathilda, a 12-year-old girl, is reluctantly taken in by Léon, a professional assassin, after her family is murdered. An unusual relationship forms as she becomes his protégée and learns the assassin's trade.",Léon: The Professional,https://www.imdb.com/title/tt0110413/,Luc Besson,1994
Parasite,2.39 : 1,11400000,"Kang-ho Song,Sun-kyun Lee,Yeo-jeong Cho,Woo-sik Choi,So-dam Park,Lee Jeong-eun,Hye-jin Jang,Myeong-hoon Park,Ji-so Jung,Hyun-jun Jung,Keun-rok Park,Esuz Jeong,Jae-myeong Jo,Ik-han Jung,Kyu-baek Kim",R,Color,South Korea,258854666,Bong Joon Ho,2h 12min,"Goyang Aqua Studio - 250 Tongil-ro 396beon-gil, Deogyang-gu, Goyang, South Korea","Comedy,Drama,Thriller",53369749,"social satire,class differences,house,fraud,scam",Korean,393216,/title/tt6751668/mediaviewer/rm3194916865,8.6,597880,8 November 2019 (USA),Dolby Atmos,"Kang-ho Song,Sun-kyun Lee,Yeo-jeong Cho","The Kims - mother and father Chung-sook and Ki-taek, and their young adult offspring, son Ki-woo and daughter Ki-jung - are a poor family living in a shabby and cramped half basement apartment in a busy lower working class commercial district of Seoul. Without even knowing it, they, especially Mr. and Mrs. Kim, literally smell of poverty. Often as a collective, they perpetrate minor scams to get by, and even when they have jobs, they do the minimum work required. Ki-woo is the one who has dreams of getting out of poverty by one day going to university. Despite not having that university education, Ki-woo is chosen by his university student friend Min, who is leaving to go to school, to take over his tutoring job to Park Da-hye, who Min plans to date once he returns to Seoul and she herself is in university. The Parks are a wealthy family who for four years have lived in their modernistic house designed by and the former residence of famed architect Namgoong. While Mr. and Mrs. Park ...",Greed and class discrimination threaten the newly formed symbiotic relationship between the wealthy Park family and the destitute Kim clan.,Parasite,https://www.imdb.com/title/tt6751668/,"Bong Joon Ho,Bong Joon Ho,1 more credit",2019
Untitled Steven Spielberg Space Project,2.39 : 1,165000000,"Ellen Burstyn,Matthew McConaughey,Mackenzie Foy,John Lithgow,Timothée Chalamet,David Oyelowo,Collette Wolfe,Francis X. McCarthy,Bill Irwin,Anne Hathaway,Andrew Borba,Wes Bentley,William Devane,Michael Caine,David Gyasi",PG-13,Color,USA,701729127,Christopher Nolan,2h 49min,"Okotoks, Alberta, Canada","Adventure,Drama,Sci-Fi",188020017,"astronaut,saving the world,relativity,gravity,nasa",English,47510360,/title/tt0816692/mediaviewer/rm4043724800,8.6,1549900,7 November 2014 (USA),Datasat,"Matthew McConaughey,Anne Hathaway,Jessica Chastain","Earth's future has been riddled by disasters, famines, and droughts. There is only one way to ensure mankind's survival: Interstellar travel. A newly discovered wormhole in the far reaches of our solar system allows a team of astronauts to go where no man has gone before, a planet that may have the right environment to sustain human life.",A team of explorers travel through a wormhole in space in an attempt to ensure humanity's survival.,Interstellar,https://www.imdb.com/title/tt0816692/,"Jonathan Nolan,Christopher Nolan",2014
Spirited Away,1.85 : 1,19000000,"Rumi Hiiragi,Miyu Irino,Mari Natsuki,Takashi Naitô,Yasuko Sawaguchi,Tatsuya Gashûin,Ryûnosuke Kamiki,Yumi Tamai,Yô Ôizumi,Koba Hayashi,Tsunehiko Kamijô,Takehiko Ono,Bunta Sugawara,Shigeru Wakita,Shirô Saitô",PG,Color,Japan,355475245,Hayao Miyazaki,2h 5min,,"Animation,Adventure,Family,Fantasy,Mystery",13750644,"spirit,spirit world,studio ghibli,child protagonist,sister sister relationship",Japanese,449839,/title/tt0245429/mediaviewer/rm4207852801,8.6,667387,28 March 2003 (USA),DTS-ES,"Daveigh Chase,Suzanne Pleshette,Miyu Irino","Chihiro and her parents are moving to a small Japanese town in the countryside, much to Chihiro's dismay. On the way to their new home, Chihiro's father makes a wrong turn and drives down a lonely one-lane road which dead-ends in front of a tunnel. Her parents decide to stop the car and explore the area. They go through the tunnel and find an abandoned amusement park on the other side, with its own little town. When her parents see a restaurant with great-smelling food but no staff, they decide to eat and pay later. However, Chihiro refuses to eat and decides to explore the theme park a bit more. She meets a boy named Haku who tells her that Chihiro and her parents are in danger, and they must leave immediately. She runs to the restaurant and finds that her parents have turned into pigs. In addition, the theme park turns out to be a town inhabited by demons, spirits, and evil gods. At the center of the town is a bathhouse where these creatures go to relax. The owner of the bathhouse ...","During her family's move to the suburbs, a sullen 10-year-old girl wanders into a world ruled by gods, witches, and spirits, and where humans are changed into beasts.",Spirited Away,https://www.imdb.com/title/tt0245429/,Hayao Miyazaki,2001
Stephen King's The Green Mile,1.85 : 1,60000000,"Tom Hanks,David Morse,Bonnie Hunt,Michael Clarke Duncan,James Cromwell,Michael Jeter,Graham Greene,Doug Hutchison,Sam Rockwell,Barry Pepper,Jeffrey DeMunn,Patricia Clarkson,Harry Dean Stanton,Dabbs Greer,Eve Brent",R,Color,USA,286801374,Frank Darabont,3h 9min,"Tennessee, USA","Crime,Drama,Fantasy,Mystery",136801374,"death row inmate,good versus evil,1930s,prison guard,death row",English,18017152,/title/tt0120689/mediaviewer/rm946247936,8.6,1169311,10 December 1999 (USA),DTS,"Tom Hanks,Michael Clarke Duncan,David Morse","Death Row guards at a penitentiary, in the 1930's, have a moral dilemma with their job when they discover one of their prisoners, a convicted murderer, has a special gift.","The lives of guards on Death Row are affected by one of their charges: a black man accused of child murder and rape, yet who has a mysterious gift.",The Green Mile,https://www.imdb.com/title/tt0120689/,"Stephen King,Frank Darabont",1999
Star Wars: Episode IV - A New Hope,2.20 : 1,11000000,"Mark Hamill,Harrison Ford,Carrie Fisher,Peter Cushing,Alec Guinness,Anthony Daniels,Kenny Baker,Peter Mayhew,David Prowse,Phil Brown,Shelagh Fraser,Jack Purvis,Alex McCrindle,Eddie Byrne,Drewe Henley",PG,Color,USA,775398007,George Lucas,2h 1min,"Shed 1, Cardington Airship Hangars, Bedfordshire, England, UK","Action,Adventure,Fantasy,Sci-Fi",460998507,"rebellion,galactic war,space opera,princess,droid",English,1554475,/title/tt0076759/mediaviewer/rm3263717120,8.6,1247502,25 May 1977 (USA),70 mm 6-Track,"Mark Hamill,Harrison Ford,Carrie Fisher","The Imperial Forces, under orders from cruel Darth Vader, hold Princess Leia hostage in their efforts to quell the rebellion against the Galactic Empire. Luke Skywalker and Han Solo, captain of the Millennium Falcon, work together with the companionable droid duo R2-D2 and C-3PO to rescue the beautiful princess, help the Rebel Alliance and restore freedom and justice to the Galaxy.","Luke Skywalker joins forces with a Jedi Knight, a cocky pilot, a Wookiee and two droids to save the galaxy from the Empire's world-destroying battle station, while also attempting to rescue Princess Leia from the mysterious Darth Vader.",Star Wars: Episode IV - A New Hope,https://www.imdb.com/title/tt0076759/,George Lucas,1977
Neon Genesis Evangelion: The End of Evangelion,1.85 : 1,,"Megumi Ogata,Megumi Hayashibara,Yûko Miyamura,Kotono Mitsuishi,Yuriko Yamaguchi,Fumihiko Tachiki,Akira Ishida,Motomu Kiyokawa,Mugihito,Takehito Koyasu,Hiro Yûki,Miki Nagasawa,Spike Spencer,Amanda Winn Lee,Tiffany Grant",R,Color,Japan,,Hideaki Anno,1h 27min,,"Animation,Action,Drama,Fantasy,Sci-Fi",,"depression,cult film,gore,sexual reference,psychological",Japanese,,/title/tt0169858/mediaviewer/rm4262290176,8.1,41186,2005 (Germany),Dolby Digital,"Megumi Ogata,Megumi Hayashibara,Yûko Miyamura","After the defeat of the final Angel, Shinji Ikari falls into a deep depression. When SEELE orders the JSSDF to make a surprise attack on NERV's headquarters, Gendo Ikari retreats down into Terminal Dogma along with Rei Ayanami, where he begins to advance his own plans for the Human Instrumentality Project. Eventually, Shinji is pushed to the limits of his sanity as he is forced to decide the fate of humanity.",Concurrent theatrical ending of the TV series Neon Genesis Evangelion (1995).,Neon Genesis Evangelion: The End of Evangelion,https://www.imdb.com/title/tt0169858/,Hideaki Anno,1997
Swades,2.35 : 1,,"Shah Rukh Khan,Gayatri Joshi,Kishori Ballal,Smit Sheth,Lekh Tandon,Rajesh Vivek,Daya Shankar Pandey,Farrukh Jaffar,Vishnudutt Gaur,Raja Awasthi,V.M. Badola,Bhim Vakani,Rahul Vohra,Rajesh Balwani,Bachan Pachehra",Not Rated,Color,India,1953889,Ashutosh Gowariker,3h 9min,"Goddard Space Flight Center - Greenbelt Road, Greenbelt, Maryland, USA",Drama,1223240,"india,village,nasa,postmaster,childhood nanny",Hindi,424804,/title/tt0367110/mediaviewer/rm3371172352,8.2,84082,17 December 2004 (India),DTS,"Shah Rukh Khan,Gayatri Joshi,Kishori Ballal","Set in modern day India, Swades is a film that tackles the issues that development throws up on a grass root level. It is to this India, which is colorful, heterogeneous and complex that Mohan Bhargava (Shah Rukh Khan), a bright young scientist working as a project manager in NASA, returns to on a quest to find his childhood nanny. The film uses the contrast between the highly developed world of NASA, which has been at the forefront of advances in space research, and this world back home in India, which is at the crossroads of development. Mohan's simple quest becomes the journey that every one of us goes through in search of that metaphysical and elusive place called ""home"".",A successful Indian scientist returns to an Indian village to take his nanny to America with him and in the process rediscovers his roots.,Swades,https://www.imdb.com/title/tt0367110/,"M.G. Sathya,Ashutosh Gowariker,9 more credits",2004
Three Colors: Red,1.85 : 1,,"Irène Jacob,Jean-Louis Trintignant,Frédérique Feder,Jean-Pierre Lorit,Samuel Le Bihan,Marion Stalens,Teco Celio,Bernard Escalon,Jean Schlegel,Elzbieta Jasinska,Paul Vermeulen,Jean-Marie Daunas,Roland Carey,Brigitte Raul,Leo Ramseyer",R,Color,Switzerland,3581969,Krzysztof Kieslowski,1h 39min,"Rue des Sources, Geneva, Canton de Genève, Switzerland","Drama,Mystery,Romance",3581969,"friendship,ex judge,eavesdropping,judge,model",French,,/title/tt0111495/mediaviewer/rm2613917696,8.1,92714,23 November 1994 (USA),Dolby SR,"Irène Jacob,Jean-Louis Trintignant,Frédérique Feder","Valentine is a young model living in Geneva. Because of a dog she ran over, she meets a retired judge who spies his neighbours' phone calls, not for money but to feed his cynicism. The film is the story of relationships between some human beings, Valentine and the judge, but also other people who may not be aware of the relationship they have with Valentine or/and the old judge. Redemption, forgiveness and compassion...",A model discovers a retired judge is keen on invading people's privacy.,Three Colors: Red,https://www.imdb.com/title/tt0111495/,"Krzysztof Kieslowski,Krzysztof Piesiewicz,4 more credits",1994
