aka,aspect_ratio,budget,cast,certificate,color,country,cumulative_gross,director,duration,filming_locations,genres,gross_usa,keywords,language,opening_weekend_usa,poster,rating,rating_count,release_date,sound_mix,stars,storyline,summary,title,url,writers,year_release
William Wyler's Ben-Hur,2.66 : 1,15000000,"Charlton Heston,Jack Hawkins,Haya Harareet,Stephen Boyd,Hugh Griffith,Martha Scott,Cathy O'Donnell,Sam Jaffe,Finlay Currie,Frank Thring,Terence Longdon,George Relph,André Morell",G,Color,USA,74427638,William Wyler,3h 32min,"Anzio, Italy","Adventure,Drama,History",74422622,"talking to a horse,roman empire,whip,person on fire,baldness",English,241792,/title/tt0052618/mediaviewer/rm136709632,8.1,222500,16 November 1961 (Mexico),6-Track Stereo,"Charlton Heston,Jack Hawkins,Stephen Boyd","Judah Ben-Hur lives as a rich Jewish prince and merchant in Jerusalem at the beginning of the 1st century. Together with the new governor his old friend Messala arrives as commanding officer of the Roman legions. At first they are happy to meet after a long time but their different politic views separate them. During the welcome parade a roof tile falls down from Judah's house and injures the governor. Although Messala knows they are not guilty, he sends Judah to the galleys and throws his mother and sister into prison. But Judah swears to come back and take revenge.","After a Jewish prince is betrayed and sent into slavery by a Roman friend, he regains his freedom and comes back for revenge.",Ben-Hur,https://www.imdb.com/title/tt0052618/,"Lew Wallace,Karl Tunberg",1959
Harry Potter and the Deathly Hallows: Part 2 3D,2.39 : 1,125000000,"Ralph Fiennes,Michael Gambon,Alan Rickman,Daniel Radcliffe,Rupert Grint,Emma Watson,Evanna Lynch,Domhnall Gleeson,Clémence Poésy,Warwick Davis,John Hurt,Helena Bonham Carter,Graham Duff,Anthony Allgood,Rusty Goffe",PG-13,Color,UK,1342321665,David Yates,2h 10min,"Swinley Forest, Bracknell, Berkshire, England, UK","Adventure,Drama,Fantasy,Mystery",381409310,"ginny weasley character,lucius malfoy character,hermione granger character,battle,final battle",English,169189427,/title/tt1201607/mediaviewer/rm3179585537,8.1,779178,15 July 2011 (USA),Dolby Digital,"Daniel Radcliffe,Emma Watson,Rupert Grint","Harry (Daniel Radcliffe), Ron (Rupert Grint), and Hermione (Emma Watson) continue their quest of finding and destroying Voldemort's (Ralph Fiennes') three remaining Horcruxes, the magical items responsible for his immortality. But as the mystical Deathly Hallows are uncovered, and Voldemort finds out about their mission, the biggest battle begins, and life as they know it will never be the same again.","Harry, Ron, and Hermione search for Voldemort's remaining Horcruxes in their effort to destroy the Dark Lord as the final battle rages on at Hogwarts.",Harry Potter and the Deathly Hallows: Part 2,https://www.imdb.com/title/tt1201607/,"Steve Kloves,J.K. Rowling",2011
Rope Burns,2.39 : 1,30000000,"Clint Eastwood,Hilary Swank,Morgan Freeman,Jay Baruchel,Mike Colter,Lucia Rijker,Brían F. O'Byrne,Anthony Mackie,Margo Martindale,Riki Lindhome,Michael Peña,Benito Martinez,Bruce MacVittie,David Powledge,Joe D'Angerio",PG-13,Color,USA,216763646,Clint Eastwood,2h 12min,"Hollywood Athletic Club - 6525 W. Sunset Blvd., Hollywood, Los Angeles, California, USA","Drama,Sport",100492203,"boxing,determination,women boxing,death,euthanasia",English,179953,/title/tt0405159/mediaviewer/rm3491335168,8.1,644170,28 January 2005 (USA),DTS,"Hilary Swank,Clint Eastwood,Morgan Freeman","Wanting to learn from the best, aspiring boxer Maggie Fitzgerald (Hilary Swank) wants Frankie Dunn (Clint Eastwood) to train her. At the outset, he flatly refuses saying he has no interest in training a girl. Frankie leads a lonely existence, alienated from his only daughter and having few friends. Maggie's rough around the edges, but shows a lot of grit in the ring and he eventually relents. Maggie not only proves to be the boxer he always dreamed of having under his wing, but a friend who fills the great void he's had in his life. Maggie's career skyrockets, but an accident in the ring leads her to ask Frankie for one last favor.",A determined woman works with a hardened boxing trainer to become a professional.,Million Dollar Baby,https://www.imdb.com/title/tt0405159/,"Paul Haggis,F.X. Toole",2004
Dead Poets Society,1.85 : 1,16400000,"Robin Williams,Robert Sean Leonard,Ethan Hawke,Josh Charles,Gale Hansen,Dylan Kussman,Allelon Ruggiero,James Waterston,Norman Lloyd,Kurtwood Smith,Carla Belver,Leon Pownall,George Martin,Joe Aufiery,Matt Carey",PG,Color,USA,235860116,Peter Weir,2h 8min,"Everett Theatre - 47 West Main Street, Middletown, Delaware, USA","Comedy,Drama",95860116,"professor,education,suicide,english teacher,poet",English,340456,/title/tt0097165/mediaviewer/rm1115750912,8.1,435274,9 June 1989 (USA),70 mm 6-Track,"Robin Williams,Robert Sean Leonard,Ethan Hawke","Painfully shy Todd Anderson has been sent to the school where his popular older brother was valedictorian. His roommate, Neil Perry, although exceedingly bright and popular, is very much under the thumb of his overbearing father. The two, along with their other friends, meet Professor Keating, their new English teacher, who tells them of the Dead Poets Society, and encourages them to go against the status quo. Each does so in his own way, and is changed for life.",Maverick teacher John Keating uses poetry to embolden his boarding school students to new heights of self-expression.,Dead Poets Society,https://www.imdb.com/title/tt0097165/,Tom Schulman,1989
Mad Max: Fury Road,2.39 : 1,150000000,"Tom Hardy,Charlize Theron,Nicholas Hoult,Hugh Keays-Byrne,Josh Helman,Nathan Jones,Zoë Kravitz,Rosie Huntington-Whiteley,Riley Keough,Abbey Lee,Courtney Eaton,John Howard,Richard Carter,Iota,Angus Sampson",R,Color,Australia,376109824,George Miller,2h,"Namib Desert, Namibia","Action,Adventure,Sci-Fi,Thriller",154058340,"post apocalypse,desert,car chase,chase,escape",English,45428128,/title/tt1392190/mediaviewer/rm3064749568,8.1,898550,15 May 2015 (USA),Dolby Digital,"Tom Hardy,Charlize Theron,Nicholas Hoult","An apocalyptic story set in the furthest reaches of our planet, in a stark desert landscape where humanity is broken, and almost everyone is crazed fighting for the necessities of life. Within this world exist two rebels on the run who just might be able to restore order. There's Max, a man of action and a man of few words, who seeks peace of mind following the loss of his wife and child in the aftermath of the chaos. And Furiosa, a woman of action and a woman who believes her path to survival may be achieved if she can make it across the desert back to her childhood homeland.","In a post-apocalyptic wasteland, a woman rebels against a tyrannical ruler in search for her homeland with the aid of a group of female prisoners, a psychotic worshiper, and a drifter named Max.",Mad Max: Fury Road,https://www.imdb.com/title/tt1392190/,"George Miller,Brendan McCarthy,1 more credit",2015
Autumn Sonata,1.66 : 1,,"Ingrid Bergman,Liv Ullmann,Lena Nyman,Halvar Björk,Marianne Aminoff,Arne Bang-Hansen,Gunnar Björnstrand,Erland Josephson,Georg Løkkeberg,Mimi Pollak,Linn Ullmann",PG,Color,West Germany,14338,Ingmar Bergman,1h 39min,Norway,"Drama,Music",,"pianist,marriage,child neglect,dysfunctional family,mother daughter estrangement",Swedish,,/title/tt0077711/mediaviewer/rm2000493312,8.2,28529,18 October 1978 (USA),Mono,"Ingrid Bergman,Liv Ullmann,Lena Nyman","After having neglected her children for many years, world famous pianist Charlotte visits her daughter Eva in her home. To her surprise she finds her other daughter, Helena, there as well. Helena is mentally disabled, and Eva has taken Helena out of the institution where their mother had placed her. The tension between Charlotte and Eva only builds up slowly, until a nightly conversation releases all the things they have wanted to tell each other.","A married daughter who longs for her mother's love is visited by the latter, a successful concert pianist.",Autumn Sonata,https://www.imdb.com/title/tt0077711/,Ingmar Bergman,1978
Frank Capra's Mr. Smith Goes to Washington,1.37 : 1,1900000,"Jean Arthur,James Stewart,Claude Rains,Edward Arnold,Guy Kibbee,Thomas Mitchell,Eugene Pallette,Beulah Bondi,H.B. Warner,Harry Carey,Astrid Allwyn,Ruth Donnelly,Grant Mitchell,Porter Hall,H.V. Kaltenborn",Passed,Black and White,USA,144738,Frank Capra,2h 9min,"Columbia/Sunset Gower Studios - 1438 N. Gower Street, Hollywood, Los Angeles, California, USA","Comedy,Drama",144738,"u.s. senator,filibuster,national film registry,afi,children",English,83205,/title/tt0031679/mediaviewer/rm2640723456,8.1,108412,19 October 1939 (USA),Mono,"James Stewart,Jean Arthur,Claude Rains","Naive and idealistic Jefferson Smith, leader of the Boy Rangers, is appointed on a lark by the spineless governor of his state. He is reunited with the state's senior senator--presidential hopeful and childhood hero, Senator Joseph Paine. In Washington, however, Smith discovers many of the shortcomings of the political process as his earnest goal of a national boys' camp leads to a conflict with the state political boss, Jim Taylor. Taylor first tries to corrupt Smith and then later attempts to destroy Smith through a scandal.","A naive man is appointed to fill a vacancy in the United States Senate. His plans promptly collide with political corruption, but he doesn't back down.",Mr. Smith Goes to Washington,https://www.imdb.com/title/tt0031679/,"Sidney Buchman,Lewis R. Foster",1939
The Bandit,1.78 : 1,"TRL1,200,000","Sener Sen,Ugur Yücel,Sermin Hürmeriç,Yesim Salkim,Kamran Usluer,Ülkü Duru,Özkan Ugur,Necdet Mahfi Ayral,Kayhan Yildizoglu,Güven Hokna,Kemal Inci,Melih Çardak,Settar Tanriögen,Celal Perk,Ümit Çirak",,Color,Turkey,,Yavuz Turgul,2h 8min,"Istanbul, Turkey","Crime,Drama,Thriller",,"bandit,money,prison,bar,mafia",Turkish,,/title/tt0116231/mediaviewer/rm3335127552,8.2,65433,29 November 1996 (Turkey),Mono,"Sener Sen,Ugur Yücel,Sermin Hürmeriç","The epic adventures of the legendary Baran the Bandit following his release from prison. After serving 35 years, it is no surprise that the world has changed dramatically. Still, Baran can't help but be shocked to discover that his home village is now underwater thanks to the construction of a new dam. He then heads for Istanbul to get revenge upon his former best friend, the man who snitched on him and stole his lover Keje. Along the way, Baran teams up with Cumali, a tough young punk who finds the thief's old-fashioned ways rather quaint. When Cumali gets into deep trouble with a crime boss, Baran adds another vengeful task to his roster.","Baran the Bandit, released from prison after 35 years, searches for vengeance and his lover.",The Bandit,https://www.imdb.com/title/tt0116231/,Yavuz Turgul,1996
Twelve Years a Slave,2.35 : 1,20000000,"Chiwetel Ejiofor,Dwight Henry,Dickie Gravois,Bryan Batt,Ashley Dyke,Kelsey Scott,Quvenzhané Wallis,Cameron Zeigler,Tony Bentley,Scoot McNairy,Taran Killam,Christopher Berry,Bill Camp,Mister Mackey Jr.,Chris Chalk",R,Color,USA,187733202,Steve McQueen,2h 14min,"New Orleans, Louisiana, USA","Biography,Drama,History",56671993,"slavery,separation from family,torture,kidnapping,racism",English,923715,/title/tt2024544/mediaviewer/rm3711556096,8.1,650588,8 November 2013 (USA),DTS,"Chiwetel Ejiofor,Michael Kenneth Williams,Michael Fassbender","Based on an incredible true story of one man's fight for survival and freedom. In the pre-Civil War United States,","In the antebellum United States, Solomon Northup , a free black man from upstate New York, is abducted and sold into slavery.",12 Years a Slave,https://www.imdb.com/title/tt2024544/,"John Ridley,Solomon Northup",2013
How to Train Your Dragon: An IMAX 3D Experience,2.35 : 1,165000000,"Jay Baruchel,Gerard Butler,Craig Ferguson,America Ferrera,Jonah Hill,Christopher Mintz-Plasse,T.J. Miller,Kristen Wiig,Robin Atkin Downes,Philip McGrade,Kieron Elliott,Ashley Jensen,David Tennant",PG,Color,USA,494879471,Dean DeBlois,1h 38min,"Chicago Illinois, USA","Animation,Action,Adventure,Family,Fantasy",217581231,"dragon,viking,village,father son relationship,island",English,43732319,/title/tt0892769/mediaviewer/rm2210040832,8.1,676632,26 March 2010 (USA),Dolby Digital,"Jay Baruchel,Gerard Butler,Christopher Mintz-Plasse","Long ago up North on the Island of Berk, the young Viking, Hiccup, wants to join his town's fight against the dragons that continually raid their town. However, his macho father and village leader, Stoik the Vast, will not allow his small, clumsy, but inventive son to do so. Regardless, Hiccup ventures out into battle and downs a mysterious Night Fury dragon with his invention, but can't bring himself to kill it. Instead, Hiccup and the dragon, whom he dubs Toothless, begin a friendship that would open up both their worlds as the observant boy learns that his people have misjudged the species. But even as the two each take flight in their own way, they find that they must fight the destructive ignorance plaguing their world.","A hapless young Viking who aspires to hunt dragons becomes the unlikely friend of a young dragon himself, and learns there may be more to the creatures than he assumed.",How to Train Your Dragon,https://www.imdb.com/title/tt0892769/,"William Davies,Dean DeBlois,3 more credits",2010
Ford v Ferrari,2.39 : 1,97600000,"Matt Damon,Christian Bale,Jon Bernthal,Caitriona Balfe,Josh Lucas,Noah Jupe,Tracy Letts,Remo Girone,Ray McKinnon,JJ Feild,Jack McMullen,Corrado Invernizzi,Joe Williamson,Ian Harding,Christopher Darga",PG-13,Color,USA,225508210,James Mangold,2h 32min,"Los Angeles, California, USA","Action,Biography,Drama,Sport",117624357,"based on true story,car racing,motor sports,racecar,racecar driver",English,31474958,/title/tt1950186/mediaviewer/rm3937571841,8.1,309721,15 November 2019 (USA),Dolby Atmos,"Matt Damon,Christian Bale,Jon Bernthal",As,American car designer Carroll Shelby and driver Ken Miles battle corporate interference and the laws of physics to build a revolutionary race car for Ford in order to defeat Ferrari at the 24 Hours of Le Mans in 1966.,Ford v Ferrari,https://www.imdb.com/title/tt1950186/,"Jez Butterworth,John-Henry Butterworth,1 more credit",2019
To Be or Not to Be,1.37 : 1,,"Carole Lombard,Jack Benny,Robert Stack,Felix Bressart,Lionel Atwill,Stanley Ridges,Sig Ruman,Tom Dugan,Charles Halton,George Lynn,Henry Victor,Maude Eburne,Halliwell Hobbes,Miles Mander",Passed,Black and White,USA,4578000,Ernst Lubitsch,1h 39min,,"Comedy,Romance,War",3270000,"screwball comedy,world war two,poland,polish resistance,reference to william shakespeare",English,,/title/tt0035446/mediaviewer/rm3433567232,8.2,31306,6 March 1942 (USA),Mono,"Carole Lombard,Jack Benny,Robert Stack","Joseph and Maria Tura operate and star in their own theater company in Warsaw. Maria has many admirers including a young lieutenant in the Polish air force, Stanislav Sobinski. When the Nazis invade Poland to start World War II, Sobinski and his colleagues flee to England while the Turas find themselves now having to operate under severe restrictions, including shelving a comical play they had written about Adolf Hitler. In England meanwhile, Sobinski and his friends give Professor Siletski - who is about to return to Poland - the names and addresses of their closest relatives so the professor can carry messages for them. When it's learned that Siletski is really a German spy, Sobinski parachutes into Poland and enlists the aid of the Turas and their fellow actors to get that list back.","During the Nazi occupation of Poland, an acting troupe becomes embroiled in a Polish soldier's efforts to track down a German spy.",To Be or Not to Be,https://www.imdb.com/title/tt0035446/,"Melchior Lengyel,Edwin Justus Mayer",1942
The Engine Driver,1.33 : 1,750000,"Marion Mack,Glen Cavender,Jim Farley,Frederick Vroom,Charles Henry Smith,Frank Barnes,Joe Keaton,Mike Donlin,Tom Nawn,Buster Keaton",Passed,Black and White,USA,,Clyde Bruckman,1h 7min,"34560 Row River Rd., Cottage Grove, Oregon, USA","Action,Adventure,Comedy,Drama,War",,"train,confederate army,national film registry,army,spy",None,,/title/tt0017925/mediaviewer/rm2687262464,8.1,82541,2 January 1927 (USA),Silent,"Buster Keaton,Marion Mack,Glen Cavender","Johnnie loves his train (""The General"") and Annabelle Lee. When the Civil War begins he is turned down for service because he's more valuable as an engineer. Annabelle thinks it's because he's a coward. Union spies capture The General with Annabelle on board. Johnnie must rescue both his loves.","When Union spies steal an engineer's beloved locomotive, he pursues it single-handedly and straight through enemy lines.",The General,https://www.imdb.com/title/tt0017925/,"Buster Keaton,Clyde Bruckman,2 more credits",1926
Barry Lyndon,1.66 : 1,11000000,"Ryan O'Neal,Marisa Berenson,Patrick Magee,Hardy Krüger,Steven Berkoff,Gay Hamilton,Marie Kean,Diana Körner,Murray Melvin,Frank Middlemass,André Morell,Arthur O'Sullivan,Godfrey Quigley,Leonard Rossiter,Philip Stone",PG,Color,UK,198992,Stanley Kubrick,3h 5min,"Royal Victoria Park, Bath, Somerset, England, UK","Adventure,Drama,History,War",,"gambler,stepfather stepson conflict,voice over narration,social climber,card playing",English,,/title/tt0072684/mediaviewer/rm1970725120,8.1,152893,18 December 1975 (USA),Mono,"Ryan O'Neal,Marisa Berenson,Patrick Magee","In the eighteenth century, in a small village in Ireland, Redmond Barry (Ryan O'Neal) is a young farm boy in love with his cousin Nora Brady (Gay Hamilton). When Nora gets engaged to British Captain John Quin (Leonard Rossiter), Barry challenges him to a duel of pistols. He wins and escapes to Dublin, but is robbed on the road. Without an alternative, Barry joins the British Army to fight in the Seven Years War. He deserts and is forced to join the Prussian Army, where he saves the life of his Captain and becomes his protégé and spy of Irish gambler Chevalier de Balibari (Patrick Magee). He helps Chevalier and becomes his associate until he decides to marry the wealthy Lady Lyndon (Marisa Berenson). They move to England and Barry, in his obsession of nobility, dissipates her fortune and makes a dangerous and revengeful enemy.",An Irish rogue wins the heart of a rich widow and assumes her dead husband's aristocratic position in 18th-century England.,Barry Lyndon,https://www.imdb.com/title/tt0072684/,"Stanley Kubrick,William Makepeace Thackeray",1975
The Big Lebowski,1.85 : 1,15000000,"Jeff Bridges,John Goodman,Julianne Moore,Steve Buscemi,David Huddleston,Philip Seymour Hoffman,Tara Reid,Philip Moon,Mark Pellegrino,Peter Stormare,Flea,Torsten Voges,Jimmie Dale Gilmore,Jack Kehler,John Turturro",R,Color,USA,46748672,Joel Coen,1h 57min,"10231 Charing Cross Road, Beverly Hills, California, USA","Comedy,Crime,Sport",18034458,"rug,nihilism,pornographer,bowling alley,death",English,5533844,/title/tt0118715/mediaviewer/rm318364928,8.1,743211,6 March 1998 (USA),DTS,"Jeff Bridges,John Goodman,Julianne Moore","When ""the dude"" Lebowski is mistaken for a millionaire Lebowski, two thugs urinate on his rug to coerce him into paying a debt he knows nothing about. While attempting to gain recompense for the ruined rug from his wealthy counterpart, he accepts a one-time job with high pay-off. He enlists the help of his bowling buddy, Walter, a gun-toting Jewish-convert with anger issues. Deception leads to more trouble, and it soon seems that everyone from porn empire tycoons to nihilists want something from The Dude.","Jeff ""The Dude"" Lebowski, mistaken for a millionaire of the same name, seeks restitution for his ruined rug and enlists his bowling buddies to help get it.",The Big Lebowski,https://www.imdb.com/title/tt0118715/,"Ethan Coen,Joel Coen",1998
Andhadhun,2.35 : 1,4500000,"Ayushmann Khurrana,Tabu,Radhika Apte,Anil Dhawan,Manav Vij,Ashwini Kalsekar,Chhaya Kadam,Zakir Hussain,Rashmi Agdekar,Abhishek Shukla,Mohini Kewalramani,Nikitasha Kapoor,Saumin Patel,Hera Sajid,Abhishek Anand",Not Rated,Color,India,62475342,Sriram Raghavan,2h 19min,"Pune, Maharashtra, India","Crime,Drama,Music,Mystery,Thriller",1193046,"blind,neo noir,pianist,murder,blackmail",Hindi,278677,/title/tt8108198/mediaviewer/rm1843230976,8.2,75254,5 October 2018 (USA),Dolby Digital,"Ayushmann Khurrana,Tabu,Radhika Apte",Akash a blind pianist is preparing for a London concert.Sophie's scooter bumps into Akash and upon finding he a pianist she takes him to her restaurant Franco's run by her father and offers him a job.Akash meets 70s actor Pramod Sinha at the restaurant who asks him to do a private concert of his songs at his residence to surprise his wife Simi. Next Day upon reaching his house a shocking surprise is waiting for Akash.,"A series of mysterious events change the life of a blind pianist, who must now report a crime that he should technically know nothing of.",Andhadhun,https://www.imdb.com/title/tt8108198/,"Arijit Biswas,Yogesh Chandekar,4 more credits",2018
The Misfit,1.33 : 1,,"Buster Keaton,Kathryn McGuire,Joe Keaton,Erwin Connelly,Ward Crane",Passed,Black and White,USA,,Buster Keaton,45min,"3630 Pasadena Ave, Los Angeles, California, USA","Action,Comedy,Romance",977375,"false accusation,surrealism,national film registry,character name as title,entering movie via screen",None,,/title/tt0015324/mediaviewer/rm761289728,8.2,43413,11 May 1924 (USA),Silent,"Buster Keaton,Kathryn McGuire,Joe Keaton","A meek and mild projectionist, who also cleans up after screenings, would like nothing better than to be a private detective. He becomes engaged to a pretty girl but a ladies man known as the Sheik vies for her affection. He gets rid of the projectionist by stealing a pocket watch belonging to the girl's father - which he pawns to buy her an expensive box of candy. He then slips the pawn ticket into the projectionist's pocket and subsequently is found by the police. He doesn't have much luck but in his dreams, he the debonair and renowned detective Sherlock Jr. who faces danger and solves the crime. In real life, the girl solves crimes quickly.","A film projectionist longs to be a detective, and puts his meagre skills to work when he is framed by a rival for stealing his girlfriend's father's pocketwatch.",Sherlock Jr.,https://www.imdb.com/title/tt0015324/,"Jean C. Havez,Joseph A. Mitchell,1 more credit",1924
Persona,1.37 : 1,,"Bibi Andersson,Liv Ullmann,Margaretha Krook,Gunnar Björnstrand",Not Rated,Black and White,Sweden,88247,Ingmar Bergman,1h 23min,"Fårö, Gotlands län, Sweden","Drama,Thriller",,"silence,patient,mute character,intercepted letter,sex on beach",Swedish,,/title/tt0060827/mediaviewer/rm794438656,8.1,106010,16 March 1967 (USA),AGA Sound System,"Bibi Andersson,Liv Ullmann,Margaretha Krook","A young nurse, Alma, is put in charge of Elisabeth Vogler: an actress who is seemingly healthy in all respects, but will not talk. As they spend time together, Alma speaks to Elisabeth constantly, never receiving any answer. Alma eventually confesses her secrets to a seemingly sympathetic Elisabeth and finds that her own personality is being submerged into Elisabeth's persona.",A nurse is put in charge of a mute actress and finds that their personae are melding together.,Persona,https://www.imdb.com/title/tt0060827/,Ingmar Bergman,1966
Prisoners,1.85 : 1,46000000,"Hugh Jackman,Jake Gyllenhaal,Viola Davis,Maria Bello,Terrence Howard,Melissa Leo,Paul Dano,Dylan Minnette,Zoë Soul,Erin Gerasimovich,Kyla-Drew,Wayne Duvall,Len Cariou,David Dastmalchian,Brad James",R,Color,USA,122126687,Denis Villeneuve,2h 33min,"Conyers, Georgia, USA","Crime,Drama,Mystery,Thriller",61002302,"child abduction,police,vigilante justice,child kidnapping,whistle",English,20817053,/title/tt1392214/mediaviewer/rm1033886464,8.1,614385,20 September 2013 (USA),SDDS,"Hugh Jackman,Jake Gyllenhaal,Viola Davis","How far would you go to protect your family? Keller Dover is facing every parent's worst nightmare. His six-year-old daughter, Anna, is missing, together with her young friend, Joy, and as minutes turn to hours, panic sets in. The only lead is a dilapidated RV that had earlier been parked on their street. Heading the investigation, Detective Loki arrests its driver, Alex Jones, but a lack of evidence forces his release. As the police pursue multiple leads and pressure mounts, knowing his child's life is at stake the frantic Dover decides he has no choice but to take matters into his own hands. But just how far will this desperate father go to protect his family?","When Keller Dover's daughter and her friend go missing, he takes matters into his own hands as the police pursue multiple leads and the pressure mounts.",Prisoners,https://www.imdb.com/title/tt1392214/,Aaron Guzikowski,2013
Hacksaw Ridge,2.35 : 1,40000000,"Andrew Garfield,Richard Pyros,Jacob Warner,Milo Gibson,Darcy Bryce,Roman Guerriero,James Lugton,Kasia Stelmach,Hugo Weaving,Rachel Griffiths,Jarin Towney,Tim McGarry,Tyler Coppin,Teresa Palmer,Richard Platt",R,Color,Australia,180450918,Mel Gibson,2h 19min,"Sydney, New South Wales, Australia","Biography,Drama,History,War",67209615,"world war two,conscientious objector,soldier,medic,1940s",English,15190758,/title/tt2119532/mediaviewer/rm2660241152,8.1,447946,4 November 2016 (USA),Dolby Atmos,"Andrew Garfield,Sam Worthington,Luke Bracey",The true story of,"World War II American Army Medic Desmond T. Doss , who served during the Battle of Okinawa, refuses to kill people, and becomes the first man in American history to receive the Medal of Honor without firing a shot.",Hacksaw Ridge,https://www.imdb.com/title/tt2119532/,"Robert Schenkkan,Andrew Knight",2016
