aka,aspect_ratio,budget,cast,certificate,color,country,cumulative_gross,director,duration,filming_locations,genres,gross_usa,keywords,language,opening_weekend_usa,poster,rating,rating_count,release_date,sound_mix,stars,storyline,summary,title,url,writers,year_release
Amadeus: The Director's Cut,2.39 : 1,18000000,"F. Murray Abraham,Tom Hulce,Elizabeth Berridge,Roy Dotrice,Simon Callow,Christine Ebersole,Jeffrey Jones,Charles Kay,Kenneth McMillan,Kenny Baker,Lisbeth Bartlett,Barbara Bryne,Martin Cavina,Roderick Cook,Milan Demjanenko",R,Color,USA,52066791,Milos Forman,2h 40min,"Tyl Theatre, Plzen, Czech Republic","Biography,Drama,History,Music",51973029,"opera,composer,classical composer,1800s,female stockinged leg",English,505276,/title/tt0086879/mediaviewer/rm3039435264,8.3,374017,19 September 1984 (USA),70 mm 6-Track,"F. Murray Abraham,Tom Hulce,Elizabeth Berridge",,"The life, success and troubles of Wolfgang Amadeus Mozart , as told by Antonio Salieri , the contemporaneous composer who was insanely jealous of Mozart's talent and claimed to have murdered him.",Amadeus,https://www.imdb.com/title/tt0086879/,"Peter Shaffer,Peter Shaffer",1984
3 Idiots,2.35 : 1,"INR550,000,000","Aamir Khan,Madhavan,Sharman Joshi,Kareena Kapoor,Boman Irani,Omi Vaidya,Mona Singh,Olivier Lafont,Rahul Kumar,Parikshit Sahni,Farida Dadi,Amardeep Jha,Mukund Bhatt,Chaitali Bose,Javed Jaffrey",PG-13,Color,India,60262836,Rajkumar Hirani,2h 50min,"Bangalore, Karnataka, India","Comedy,Drama",6532874,"papadum,hairy chest,against the system,coming of age,college",Hindi,1645502,/title/tt1187043/mediaviewer/rm2029391104,8.4,351718,25 December 2009 (India),Dolby Digital,"Aamir Khan,Madhavan,Mona Singh","Farhan Qureshi and Raju Rastogi want to re-unite with their fellow collegian, Rancho, after faking a stroke aboard an Air India plane, and excusing himself from his wife - trouser less - respectively. Enroute, they encounter another student, Chatur Ramalingam, now a successful businessman, who reminds them of a bet they had undertaken 10 years ago. The trio, while recollecting hilarious antics, including their run-ins with the Dean of Delhi's Imperial College of Engineering, Viru Sahastrabudhe, race to locate Rancho, at his last known address - little knowing the secret that was kept from them all this time.","Two friends are searching for their long lost companion. They revisit their college days and recall the memories of their friend who inspired them to think differently, even as the rest of the world called them ""idiots"".",3 Idiots,https://www.imdb.com/title/tt1187043/,"Rajkumar Hirani,Abhijat Joshi,3 more credits",2009
The Boat,1.66 : 1,"DEM32,000,000","Jürgen Prochnow,Herbert Grönemeyer,Klaus Wennemann,Hubertus Bengsch,Martin Semmelrogge,Bernd Tauber,Erwin Leder,Martin May,Heinz Hoenig,Uwe Ochsenknecht,Claude-Oliver Rudolph,Jan Fedder,Ralf Richter,Joachim Bernhard,Oliver Stritzel",R,Color,West Germany,11487676,Wolfgang Petersen,2h 29min,"Bodensee, Bavaria, Germany","Adventure,Drama,Thriller,War",11487676,"submarine movie,war at sea,claustrophobic setting,sonar,submarine captain",German,26994,/title/tt0082096/mediaviewer/rm230362112,8.3,235027,10 February 1982 (USA),Dolby Digital,"Jürgen Prochnow,Herbert Grönemeyer,Klaus Wennemann","It is 1942 and the German submarine fleet is heavily engaged in the so-called ""Battle of the Atlantic"" to harass and destroy British shipping. With better escorts of the destroyer class, however, German U-boats have begun to take heavy losses. ""Das Boot"" is the story of the crew of one such U-Boat, with the film examining how these submariners maintained their professionalism as soldiers and attempted to accomplish impossible missions, all the while attempting to understand and obey the ideology of the government under which they served.","The claustrophobic world of a WWII German U-boat; boredom, filth and sheer terror.",Das Boot,https://www.imdb.com/title/tt0082096/,"Wolfgang Petersen,Lothar G. Buchheim",1981
Toy Story in 3-D,1.66 : 1,30000000,"Tom Hanks,Tim Allen,Don Rickles,Jim Varney,Wallace Shawn,John Ratzenberger,Annie Potts,John Morris,Erik von Detten,Laurie Metcalf,R. Lee Ermey,Sarah Rayne,Penn Jillette,Jack Angel,Spencer Aste",G,Color,USA,394436586,John Lasseter,1h 21min,"Pixar Animation Studios - 1200 Park Avenue, Emeryville, California, USA","Animation,Adventure,Comedy,Family,Fantasy",223225679,"toy,toy comes to life,rivalry,cowboy,cgi animation",English,29140617,/title/tt0114709/mediaviewer/rm3813007616,8.3,901773,22 November 1995 (USA),Dolby SR,"Tom Hanks,Tim Allen,Don Rickles","A little boy named Andy loves to be in his room, playing with his toys, especially his doll named ""Woody"". But, what do the toys do when Andy is not with them, they come to life. Woody believes that his life (as a toy) is good. However, he must worry about Andy's family moving, and what Woody does not know is about Andy's birthday party. Woody does not realize that Andy's mother gave him an action figure known as Buzz Lightyear, who does not believe that he is a toy, and quickly becomes Andy's new favorite toy. Woody, who is now consumed with jealousy, tries to get rid of Buzz. Then, both Woody and Buzz are now lost. They must find a way to get back to Andy before he moves without them, but they will have to pass through a ruthless toy killer, Sid Phillips.",A cowboy doll is profoundly threatened and jealous when a new spaceman figure supplants him as top toy in a boy's room.,Toy Story,https://www.imdb.com/title/tt0114709/,"John Lasseter,Pete Docter,6 more credits",1995
High and Low,2.35 : 1,,"Toshirô Mifune,Tatsuya Nakadai,Kyôko Kagawa,Tatsuya Mihashi,Isao Kimura,Kenjirô Ishiyama,Takeshi Katô,Takashi Shimura,Jun Tazaki,Nobuo Nakamura,Yûnosuke Itô,Tsutomu Yamazaki,Minoru Chiaki,Eijirô Tôno,Masao Shimizu",Not Rated,Black and White,Japan,46808,Akira Kurosawa,2h 23min,"Enoshima, Kanagawa, Japan","Crime,Drama,Mystery,Thriller",46808,"house on a hill,detective,ransom,chauffeur,japanese law enforcement",Japanese,15942,/title/tt0057565/mediaviewer/rm794168832,8.4,36300,26 November 1963 (USA),4-Track Stereo,"Toshirô Mifune,Yutaka Sada,Tatsuya Nakadai","A wealthy businessman is told his son has been kidnapped and he will have to pay a very large sum for him to be returned safely. It is then discovered that his son is safe at home: the kidnapper took his chauffeur's son by accident. The kidnapper says this makes no difference: pay up or the child dies. This leaves him with a moral dilemma, as he really needs the money to conclude a very important business deal.",An executive of a shoe company becomes a victim of extortion when his chauffeur's son is kidnapped and held for ransom.,High and Low,https://www.imdb.com/title/tt0057565/,"Hideo Oguni,Ryûzô Kikushima,3 more credits",1963
Braveheart,2.39 : 1,72000000,"James Robinson,Sean Lawlor,Sandy Nelson,James Cosmo,Sean McGinley,Alan Tall,Andrew Weir,Gerda Stevenson,Ralph Riach,Mhairi Calvey,Brian Cox,Patrick McGoohan,Peter Hanly,Sophie Marceau,Stephen Billington",R,Color,USA,213216216,Mel Gibson,2h 58min,"Arizona, USA","Biography,Drama,History,War",75609945,"scotland,revolt,legend,secret marriage,based on true story",English,9938276,/title/tt0112573/mediaviewer/rm3170786816,8.3,970720,24 May 1995 (USA),DTS,"Mel Gibson,Sophie Marceau,Patrick McGoohan","William Wallace is a Scottish rebel who leads an uprising against the cruel English ruler Edward the Longshanks, who wishes to inherit the crown of Scotland for himself. When he was a young boy, William Wallace's father and brother, along with many others, lost their lives trying to free Scotland. Once he loses another of his loved ones, William Wallace begins his long quest to make Scotland free once and for all, along with the assistance of Robert the Bruce.",Scottish warrior William Wallace leads his countrymen in a rebellion to free his homeland from the tyranny of King Edward I of England.,Braveheart,https://www.imdb.com/title/tt0112573/,Randall Wallace,1995
American Beauty,2.39 : 1,15000000,"Kevin Spacey,Annette Bening,Thora Birch,Wes Bentley,Mena Suvari,Peter Gallagher,Allison Janney,Chris Cooper,Scott Bakula,Sam Robards,Barry Del Sherman,Ara Celi,John Cho,Fort Atkinson,Sue Casey",R,Color,USA,356296601,Sam Mendes,2h 2min,"11388 Homedale Street, Brentwood, Los Angeles, California, USA",Drama,130096601,"adulterous wife,cheating wife,midlife crisis,unfaithful wife,breasts",English,861531,/title/tt0169547/mediaviewer/rm2430294272,8.3,1082398,1 October 1999 (USA),DTS,"Kevin Spacey,Annette Bening,Thora Birch","After his death sometime in his forty-third year, suburbanite Lester Burnham tells of the last few weeks of his life, during which he had no idea of his imminent passing. He is a husband to real estate agent Carolyn Burnham and father to high school student Janie Burnham. Although Lester and Carolyn once loved each other, they now merely tolerate each other. Typical wallflower Janie too hates both her parents, the three who suffer individually in silence in their home life. Janie tries to steer clear of both her parents. Carolyn, relatively new to the real estate business, wants to create the persona of success to further her career, she aspiring to the professional life of Buddy Kane, the king of the real estate business in their neighborhood. Lester merely walks mindlessly through life, including at his job in advertising. His company is downsizing, and he, like all the other employees, has to justify his position to the newly hired efficiency expert to keep his job. Things change ...",A sexually frustrated suburban father has a mid-life crisis after becoming infatuated with his daughter's best friend.,American Beauty,https://www.imdb.com/title/tt0169547/,Alan Ball,1999
Chaos,2.35 : 1,4000000,"Zain Al Rafeea,Yordanos Shiferaw,Boluwatife Treasure Bankole,Kawsar Al Haddad,Fadi Yousef,Cedra Izzam,Alaa Chouchnieh,Elias Khoury,Mohammad Al Abdallah,Mohamad Abdellatif,Abdo Abdo,Hampig Abraham,Jamil Ahmad,Mohamad Akkar,Elias Akobegia",R,Color,Lebanon,64417003,Nadine Labaki,2h 6min,"Beirut, Lebanon",Drama,1661096,"prison,baby,poverty,breast feeding,boy",Arabic,24988,/title/tt8267604/mediaviewer/rm40003584,8.4,67841,8 February 2019 (Mexico),Dolby Digital,"Zain Al Rafeea,Yordanos Shiferaw,Boluwatife Treasure Bankole","Capernaüm (""Chaos"") tells the story of Zain (Zain al-Rafeea), a Lebanese boy who sues his parents for the ""crime"" of giving him life. The film follows Zain as he journeys from gutsy, streetwise child to hardened 12-year-old ""adult"" fleeing his negligent parents, surviving through his wits on the streets, where he meets Ethiopian migrant worker Rahil, who provides him with shelter and food, as Zain takes care of her baby son Yonas in return. Zain later gets jailed for committing a violent crime, and finally seeks justice in a courtroom.","While serving a five-year sentence for a violent crime, a 12-year-old boy sues his parents for neglect.",Capernaum,https://www.imdb.com/title/tt8267604/,"Nadine Labaki,Jihad Hojeily,3 more credits",2018
Avengers 4,2.39 : 1,356000000,"Robert Downey Jr.,Chris Evans,Mark Ruffalo,Chris Hemsworth,Scarlett Johansson,Jeremy Renner,Don Cheadle,Paul Rudd,Benedict Cumberbatch,Chadwick Boseman,Brie Larson,Tom Holland,Karen Gillan,Zoe Saldana,Evangeline Lilly",PG-13,Color,USA,2797501328,Anthony Russo,3h 1min,"Atlanta, Georgia, USA","Action,Adventure,Drama,Sci-Fi",858373000,"time travel,superhero,super villain,cosmic,marvel cinematic universe",English,357115007,/title/tt4154796/mediaviewer/rm2775147008,8.4,863936,26 April 2019 (USA),Dolby Atmos,"Robert Downey Jr.,Chris Evans,Mark Ruffalo","After the devastating events of Avengers: Infinity War (2018), the universe is in ruins due to the efforts of the Mad Titan, Thanos. With the help of remaining allies, the Avengers must assemble once more in order to undo Thanos's actions and undo the chaos to the universe, no matter what consequences may be in store, and no matter who they face...","After the devastating events of Avengers: Infinity War (2018), the universe is in ruins. With the help of remaining allies, the Avengers assemble once more in order to reverse Thanos' actions and restore balance to the universe.",Avengers: Endgame,https://www.imdb.com/title/tt4154796/,"Christopher Markus,Stephen McFeely,14 more credits",2019
Alien II,1.85 : 1,18500000,"Sigourney Weaver,Carrie Henn,Michael Biehn,Paul Reiser,Lance Henriksen,Bill Paxton,William Hope,Jenette Goldstein,Al Matthews,Mark Rolston,Ricco Ross,Colette Hiller,Daniel Kash,Cynthia Dale Scott,Tip Tipping",R,Color,UK,131060248,James Cameron,2h 17min,"Acton Lane Power Station, Acton Lane, Acton, London, England, UK","Action,Adventure,Sci-Fi,Thriller",85160248,"alien,rescue mission,soldier,monster,death of daughter",English,10052042,/title/tt0090605/mediaviewer/rm490960896,8.3,661142,18 July 1986 (USA),70 mm 6-Track,"Sigourney Weaver,Michael Biehn,Carrie Henn","57 years after Ellen Ripley had a close encounter with the reptilian alien creature from the first movie, she is called back, this time, to help a group of highly trained colonial marines fight off against the sinister extraterrestrials. But this time, the aliens have taken over a space colony on the moon LV-426. When the colonial marines are called upon to search the deserted space colony, they later find out that they are up against more than what they bargained for. Using specially modified machine guns and enough firepower, it's either fight or die as the space marines battle against the aliens. As the Marines do their best to defend themselves, Ripley must attempt to protect a young girl who is the sole survivor of the nearly wiped out space colony.","Fifty-seven years after surviving an apocalyptic attack aboard her space vessel by merciless space creatures, Officer Ripley awakens from hyper-sleep and tries to warn anyone who will listen about the predators.",Aliens,https://www.imdb.com/title/tt0090605/,"James Cameron,David Giler,4 more credits",1986
Untitled Dia de los Muertos Project,2.35 : 1,175000000,"Anthony Gonzalez,Gael García Bernal,Benjamin Bratt,Alanna Ubach,Renee Victor,Jaime Camil,Alfonso Arau,Herbert Siguenza,Gabriel Iglesias,Lombardo Boyar,Ana Ofelia Murguía,Natalia Cordova-Buckley,Selene Luna,Edward James Olmos,Sofía Espinosa",PG,Color,USA,807817888,Lee Unkrich,1h 45min,"Pixar Animation Studios - 1200 Park Avenue, Emeryville, California, USA","Animation,Adventure,Family,Fantasy,Music,Mystery",210460015,"afterlife,day of the dead,mexico,musician,death",English,50802605,/title/tt2380307/mediaviewer/rm585455872,8.4,402007,22 November 2017 (USA),Dolby Atmos,"Anthony Gonzalez,Gael García Bernal,Benjamin Bratt","Despite his family's baffling generations-old ban on music, Miguel dreams of becoming an accomplished musician like his idol, Ernesto de la Cruz. Desperate to prove his talent, Miguel finds himself in the stunning and colorful Land of the Dead following a mysterious chain of events. Along the way, he meets charming trickster Hector, and together, they set off on an extraordinary journey to unlock the real story behind Miguel's family history.","Aspiring musician Miguel, confronted with his family's ancestral ban on music, enters the Land of the Dead to find his great-great-grandfather, a legendary singer.",Coco,https://www.imdb.com/title/tt2380307/,"Lee Unkrich,Jason Katz,4 more credits",2017
Your Name.,1.78 : 1,"JPY370,000,000","Ryûnosuke Kamiki,Mone Kamishiraishi,Ryô Narita,Aoi Yûki,Nobunaga Shimazaki,Kaito Ishikawa,Kanon Tani,Masaki Terasoma,Sayaka Ôhara,Kazuhiko Inoue,Chafûrin,Kana Hanazawa,Yuka Terasaki,Takashi Onozuka,Yôhei Namekawa",PG,Color,Japan,358922706,Makoto Shinkai,1h 46min,,"Animation,Drama,Fantasy,Romance",5017246,"japanese high school girl,in love with a co worker,short skirt,upskirt,japanese schoolgirl",Japanese,1813781,/title/tt5311514/mediaviewer/rm3216783616,8.4,206305,7 April 2017 (USA),Dolby Digital,"Ryûnosuke Kamiki,Mone Kamishiraishi,Ryô Narita",Mitsuha is the daughter of the mayor of a small mountain town. She's a straightforward high school girl who lives with her sister and her grandmother and has no qualms about letting it be known that she's uninterested in Shinto rituals or helping her father's electoral campaign. Instead she dreams of leaving the boring town and trying her luck in Tokyo. Taki is a high school boy in Tokyo who works part-time in an Italian restaurant and aspires to become an architect or an artist. Every night he has a strange dream where he becomes...a high school girl in a small mountain town.,"Two strangers find themselves linked in a bizarre way. When a connection forms, will distance be the only thing to keep them apart?",Your Name.,https://www.imdb.com/title/tt5311514/,"Makoto Shinkai,Makoto Shinkai,1 more credit",2016
Once Upon a Time in America,1.85 : 1,30000000,"Robert De Niro,James Woods,Elizabeth McGovern,Treat Williams,Tuesday Weld,Burt Young,Joe Pesci,Danny Aiello,William Forsythe,James Hayden,Darlanne Fluegel,Larry Rapp,Dutch Miller,Robert Harper,Richard Bright",R,Color,Italy,5472914,Sergio Leone,3h 49min,"Intersection of Washington Street and Water Street, Dumbo, Brooklyn, New York City, New York, USA","Crime,Drama",5321508,"corrupt police,police corruption,pig,doggystyle sex,bacon",English,2412014,/title/tt0087843/mediaviewer/rm480514304,8.4,317201,1 June 1984 (USA),Mono,"Robert De Niro,James Woods,Elizabeth McGovern","With the vivid memory of his long-gone childhood friends, Max, Patsy, and Cockeye, etched in his mind, his ferociously loyal partners-in-crime during their rise to prominence in New York's Prohibition-era Lower East Side, the defeated, penniless, and guilt-ridden former gangster, David ""Noodles"" Aaronson, returns to Manhattan. Not knowing what to expect, while on a mission to shed light on his opaque past, grizzled Noodles reunites with his only living friend, Fat Moe, after thirty-five haunted years of self-exile. However, the relentless, piercing sound of culpability stands in the way of finding closure, as the inscrutable content of a well-worn leather suitcase further complicates matters. And now, against the backdrop of a torn conscience, the sad and bittersweet recollections of more than fifty years of love, death, and everything in between, become inextricably intertwined, leading to even more puzzling questions. But, what are a man's options when he is left with nothing?","A former Prohibition-era Jewish gangster returns to the Lower East Side of Manhattan over thirty years later, where he once again must confront the ghosts and regrets of his old life.",Once Upon a Time in America,https://www.imdb.com/title/tt0087843/,"Harry Grey,Leonardo Benvenuti,6 more credits",1984
Arkham,2.39 : 1,250000000,"Christian Bale,Gary Oldman,Tom Hardy,Joseph Gordon-Levitt,Anne Hathaway,Marion Cotillard,Morgan Freeman,Michael Caine,Matthew Modine,Alon Aboutboul,Ben Mendelsohn,Burn Gorman,Daniel Sunjata,Aidan Gillen,Sam Kennard",PG-13,Color,UK,1081142612,Christopher Nolan,2h 44min,"Downtown, Los Angeles, California, USA","Action,Adventure",448139099,"dc comics,batman character,terrorist plot,bruce wayne character,sequel",English,160887295,/title/tt1345836/mediaviewer/rm834516224,8.4,1540121,20 July 2012 (USA),SDDS,"Christian Bale,Tom Hardy,Anne Hathaway","Despite his tarnished reputation after the events of The Dark Knight (2008), in which he took the rap for Dent's crimes, Batman feels compelled to intervene to assist the city and its Police force, which is struggling to cope with Bane's plans to destroy the city.","Eight years after the Joker's reign of anarchy, Batman, with the help of the enigmatic Catwoman, is forced from his exile to save Gotham City from the brutal guerrilla terrorist Bane.",The Dark Knight Rises,https://www.imdb.com/title/tt1345836/,"Jonathan Nolan,Christopher Nolan,3 more credits",2012
A Delicate Balance of Terror,1.37 : 1,1800000,"Peter Sellers,George C. Scott,Sterling Hayden,Keenan Wynn,Slim Pickens,Peter Bull,James Earl Jones,Tracy Reed,Jack Creley,Frank Berry,Robert O'Neil,Glenn Beck,Roy Stephens,Shane Rimmer,Hal Galili",PG,Black and White,UK,9444747,Stanley Kubrick,1h 35min,"Okaloosa County, Florida, USA",Comedy,9440272,"war room,u.s. president,bodily fluids,nuclear holocaust,nuclear weapons",English,11751,/title/tt0057012/mediaviewer/rm3960095232,8.4,456282,29 January 1964 (USA),Mono,"Peter Sellers,George C. Scott,Sterling Hayden","Paranoid Brigadier General Jack D. Ripper of Burpelson Air Force Base, believing that fluoridation of the American water supply is a Soviet plot to poison the U.S. populace, is able to deploy through a back door mechanism a nuclear attack on the Soviet Union without the knowledge of his superiors, including the Chair of the Joint Chiefs of Staff, General Buck Turgidson, and President Merkin Muffley. Only Ripper knows the code to recall the B-52 bombers and he has shut down communication in and out of Burpelson as a measure to protect this attack. Ripper's executive officer, RAF Group Captain Lionel Mandrake (on exchange from Britain), who is being held at Burpelson by Ripper, believes he knows the recall codes if he can only get a message to the outside world. Meanwhile at the Pentagon War Room, key persons including Muffley, Turgidson and nuclear scientist and adviser, a former Nazi named Dr. Strangelove, are discussing measures to stop the attack or mitigate its blow-up into an all ...",An insane general triggers a path to nuclear holocaust that a War Room full of politicians and generals frantically tries to stop.,Dr. Strangelove or: How I Learned to Stop Worrying and Love the Bomb,https://www.imdb.com/title/tt0057012/,"Stanley Kubrick,Terry Southern,2 more credits",1964
Princess Mononoke,1.85 : 1,"JPY2,400,000,000","Billy Crudup,Billy Bob Thornton,Minnie Driver,John DiMaggio,Claire Danes,John DeMita,Jada Pinkett Smith,Gillian Anderson,Keith David,Corey Burton,Tara Strong,Julia Fletcher,Debi Derryberry,Alex Fernandez,Jack Fletcher",PG-13,Color,Japan,169785704,Hayao Miyazaki,2h 14min,,"Animation,Action,Adventure,Fantasy",4845631,"forest,anime,human animal relationship,curse,princess",Japanese,144446,/title/tt0119698/mediaviewer/rm1908765440,8.4,351076,19 December 1997 (USA),Dolby Digital,"Yôji Matsuda,Yuriko Ishida,Yûko Tanaka","While protecting his village from rampaging boar-god/demon, a confident young warrior, Ashitaka, is stricken by a deadly curse. To save his life, he must journey to the forests of the west. Once there, he's embroiled in a fierce campaign that humans were waging on the forest. The ambitious Lady Eboshi and her loyal clan use their guns against the gods of the forest and a brave young woman, Princess Mononoke, who was raised by a wolf-god. Ashitaka sees the good in both sides and tries to stem the flood of blood. This is met by animosity by both sides as they each see him as supporting the enemy.","On a journey to find the cure for a Tatarigami's curse, Ashitaka finds himself in the middle of a war between the forest gods and Tatara, a mining colony. In this quest he also meets San, the Mononoke Hime.",Princess Mononoke,https://www.imdb.com/title/tt0119698/,"Hayao Miyazaki,Neil Gaiman,1 more credit",1997
Oldboy,2.35 : 1,3000000,"Choi Min-sik,Yoo Ji-Tae,Kang Hye-jeong,Kim Byeong-Ok,Dae-han Ji,Dal-su Oh,Seung-shin Lee,Jin-Seo Yoon,Tae-kyung Oh,Yoo Yeon-Seok,Il-han Oo,Young-hee Lee,Young-ae Kim,Mi Mi Lee,Jae-Duk Han",R,Color,South Korea,15002116,Chan-wook Park,2h,"Songgye High School, Chinju, Kyongsangnam-Do, South Korea","Action,Drama,Mystery,Thriller",707481,"imprisonment,psychological torture,revenge,brother sister relationship,captive",Korean,68957,/title/tt0364569/mediaviewer/rm1299029248,8.4,524927,21 November 2003 (South Korea),Dolby Digital,"Choi Min-sik,Yoo Ji-Tae,Kang Hye-jeong","Abducted on a rainy night in 1988, the obnoxious drunk, Oh Dae-Su, much to his surprise, wakes up locked in a windowless and dilapidated hotel room, for an unknown reason. There, his invisible and pitiless captors will feed him, clothe him, and sedate him to avert a desperate suicide--and as his only companion and a window to the world is the TV in his stark cell--the only thing that helps Oh Dae-Su keep going is his daily journal. Then, unexpectedly, after fifteen long years in captivity, the perplexed prisoner is deliberately released, encouraged to track down his tormentor to finally get his retribution. However, who would hate Oh Dae-Su so much he would deny him of a quick and clean death?","After being kidnapped and imprisoned for fifteen years, Oh Dae-Su is released, only to find that he must find his captor in five days.",Oldboy,https://www.imdb.com/title/tt0364569/,"Garon Tsuchiya,Nobuaki Minegishi,4 more credits",2003
