aka,aspect_ratio,budget,cast,certificate,color,country,cumulative_gross,director,duration,filming_locations,genres,gross_usa,keywords,language,opening_weekend_usa,poster,rating,rating_count,release_date,sound_mix,stars,storyline,summary,title,url,writers,year_release
Chinatown,2.35 : 1,6000000,"Jack Nicholson,Faye Dunaway,John Huston,Perry Lopez,John Hillerman,Darrell Zwerling,Diane Ladd,Roy Jenson,Roman Polanski,Richard Bakalyan,Joe Mantell,Bruce Glover,Nandu Hinds,James O'Rear,James Hong",R,Color,USA,29225935,Roman Polanski,2h 10min,"Trident Ranch (actor Walter Brennan's then-home), 3240 Sunset Valley Road, Moorpark, California, USA","Drama,Mystery,Thriller",29200000,"neo noir,police,private detective,femme fatale,detective",English,,/title/tt0071315/mediaviewer/rm880430336,8.1,299372,20 June 1974 (USA),Mono,"Jack Nicholson,Faye Dunaway,John Huston","In 1937 Los Angeles, private investigator Jake 'J.J.' Gittes specializes in cheating-spouse cases. His current target is Hollis Mulwray, high-profile chief engineer for the Los Angeles Department of Water and Power, whose wife suspects him of infidelity. In following Mulwray, Gittes witnesses some usual business dealings, such as a public meeting for construction of a new dam to create additional water supply for Los Angeles, as fresh water is vital to the growing community during the chronic drought; Mulwray opposes the dam. Eventually Gittes sees Mulwray meeting with an unknown young woman who isn't his wife. Once news of the supposed tryst between Mulwray and this woman hits the media, additional information comes to light that makes Gittes believe that Mulwray is being framed for something and that he himself is being set up. In his investigation of the issue behind Mulwray's framing and his own setup, Gittes is assisted by Mulwray's wife Evelyn, but he thinks she isn't being ...","A private detective hired to expose an adulterer finds himself caught up in a web of deceit, corruption, and murder.",Chinatown,https://www.imdb.com/title/tt0071315/,Robert Towne,1974
No Country for Old Men,2.39 : 1,25000000,"Tommy Lee Jones,Javier Bardem,Josh Brolin,Woody Harrelson,Kelly Macdonald,Garret Dillahunt,Tess Harper,Barry Corbin,Stephen Root,Rodger Boyce,Beth Grant,Ana Reeder,Kit Gwin,Zach Hopkins,Chip Love",R,Color,USA,171627166,Ethan Coen,2h 2min,"Santa Fe, New Mexico, USA","Crime,Drama,Thriller",74283625,"sheriff,texas,contemporary western,cold blooded murder,desert",English,1202000,/title/tt0477348/mediaviewer/rm1263244032,8.1,873400,21 November 2007 (USA),SDDS,"Tommy Lee Jones,Javier Bardem,Josh Brolin","In rural Texas, welder and hunter Llewelyn Moss (",Violence and mayhem ensue after a hunter stumbles upon a drug deal gone wrong and more than two million dollars in cash near the Rio Grande.,No Country for Old Men,https://www.imdb.com/title/tt0477348/,"Joel Coen,Ethan Coen,1 more credit",2007
The Gold Rush,1.33 : 1,923000,"Charles Chaplin,Mack Swain,Tom Murray,Henry Bergman,Malcolm Waite,Georgia Hale",Passed,Black and White,USA,26916,Charles Chaplin,1h 35min,"California, USA","Adventure,Comedy,Drama,Western",,"gold,klondike,klondike gold rush,national film registry,little tramp",None,,/title/tt0015864/mediaviewer/rm3169271296,8.2,102949,13 July 1925 (Brazil),Mono,"Charles Chaplin,Mack Swain,Tom Murray",A lone prospector ventures into Alaska looking for gold. He gets mixed up with some burly characters and falls in love with the beautiful Georgia. He tries to win her heart with his singular charm.,A prospector goes to the Klondike in search of gold and finds it and more.,The Gold Rush,https://www.imdb.com/title/tt0015864/,Charles Chaplin,1925
Three Billboards,2.35 : 1,15000000,"Frances McDormand,Caleb Landry Jones,Kerry Condon,Sam Rockwell,Alejandro Barrios,Jason Ledford,Darrell Britt-Gibson,Woody Harrelson,Abbie Cornish,Riya May Atwood,Selah Atwood,Lucas Hedges,Zeljko Ivanek,Amanda Warren,Malaya Rivera Drew",R,Color,UK,160192267,Martin McDonagh,1h 55min,"Asheville, North Carolina, USA","Comedy,Crime,Drama",54513740,"billboard,police brutality,black comedy,ambiguous ending,thrown through a window",English,322168,/title/tt5027774/mediaviewer/rm3800849152,8.1,446694,1 December 2017 (USA),Dolby Digital,"Frances McDormand,Woody Harrelson,Sam Rockwell","THREE BILLBOARDS OUTSIDE EBBING, MISSOURI is a darkly comic drama from Academy Award nominee Martin McDonagh (In Bruges). After months have passed without a culprit in her daughter's murder case, Mildred Hayes (Academy Award winner Frances McDormand) makes a bold move, painting three signs leading into her town with a controversial message directed at William Willoughby (Academy Award nominee Woody Harrelson), the town's revered chief of police. When his second-in-command Officer Dixon (Academy Award winner Sam Rockwell), an immature mother's boy with a penchant for violence, gets involved, the battle between Mildred and Ebbing's law enforcement is only exacerbated.",A mother personally challenges the local authorities to solve her daughter's murder when they fail to catch the culprit.,"Three Billboards Outside Ebbing, Missouri",https://www.imdb.com/title/tt5027774/,Martin McDonagh,2017
Ashecliffe,2.39 : 1,80000000,"Leonardo DiCaprio,Mark Ruffalo,Ben Kingsley,Max von Sydow,Michelle Williams,Emily Mortimer,Patricia Clarkson,Jackie Earle Haley,Ted Levine,John Carroll Lynch,Elias Koteas,Robin Bartlett,Christopher Denham,Nellie Sciutto,Joseph Sikora",R,Color,USA,294805697,Martin Scorsese,2h 18min,"433 So Spring st Los Angeles, California, USA","Mystery,Thriller",128012934,"surprise ending,mental asylum,self delusion,psyche,neo noir",English,41062440,/title/tt1130884/mediaviewer/rm1814907136,8.2,1154700,19 February 2010 (USA),SDDS,"Leonardo DiCaprio,Emily Mortimer,Mark Ruffalo","In 1954, up-and-coming U.S. marshal Teddy Daniels is assigned to investigate the disappearance of a patient from Boston's Shutter Island Ashecliffe Hospital. He's been pushing for an assignment on the island for personal reasons, but before long he thinks he's been brought there as part of a twisted plot by hospital doctors whose radical treatments range from unethical to illegal to downright sinister. Teddy's shrewd investigating skills soon provide a promising lead, but the hospital refuses him access to records he suspects would break the case wide open. As a hurricane cuts off communication with the mainland, more dangerous criminals ""escape"" in the confusion, and the puzzling, improbable clues multiply, Teddy begins to doubt everything - his memory, his partner, even his own sanity.","In 1954, a U.S. Marshal investigates the disappearance of a murderer who escaped from a hospital for the criminally insane.",Shutter Island,https://www.imdb.com/title/tt1130884/,"Laeta Kalogridis,Dennis Lehane",2010
Dial 'M' for Murder,1.66 : 1,1400000,"Ray Milland,Grace Kelly,Robert Cummings,John Williams,Anthony Dawson,Leo Britt,Patrick Allen,George Leigh,George Alderson,Robin Hughes",PG,Color,USA,18816,Alfred Hitchcock,1h 45min,"Stage 20, Warner Brothers Burbank Studios - 4000 Warner Boulevard, Burbank, California, USA","Crime,Thriller",12562,"blackmail,murder,tennis player,love letter,key",English,12562,/title/tt0046912/mediaviewer/rm802307584,8.2,161096,29 May 1954 (USA),Mono,"Ray Milland,Grace Kelly,Robert Cummings","In London, wealthy Margot Mary Wendice had a brief love affair with the American writer Mark Halliday while her husband and professional tennis player Tony Wendice was on a tennis tour. Tony quits playing to dedicate to his wife and finds a regular job. She decides to give him a second chance for their marriage. When Mark arrives from America to visit the couple, Margot tells him that she had destroyed all his letters but one that was stolen. Subsequently she was blackmailed, but she had never retrieved the stolen letter. Tony arrives home, claims that he needs to work and asks Margot to go with Mark to the theater. Meanwhile Tony calls Captain Lesgate (aka Charles Alexander Swann who studied with him at college) and blackmails him to murder his wife, so that he can inherit her fortune. But there is no perfect crime, and things do not work as planned.",A former tennis player tries to arrange his wife's murder after learning of her affair.,Dial M for Murder,https://www.imdb.com/title/tt0046912/,"Frederick Knott,Frederick Knott",1954
Treasure of Sierra Madre,1.37 : 1,3000000,"Humphrey Bogart,Walter Huston,Tim Holt,Bruce Bennett,Barton MacLane,Alfonso Bedoya,Arturo Soto Rangel,Manuel Dondé,José Torvay,Margarito Luna",Passed,Black and White,USA,5014000,John Huston,2h 6min,"Tucson, Arizona, USA","Adventure,Drama,Western",5014000,"mexico,sierra madre mountains,national film registry,afi,year 1925",English,144074,/title/tt0040897/mediaviewer/rm2805550592,8.2,115926,24 January 1948 (USA),Mono,"Humphrey Bogart,Walter Huston,Tim Holt","Fred C. Dobbs and Bob Curtin, both down on their luck in Tampico, Mexico in 1925, meet up with a grizzled prospector named Howard and decide to join with him in search of gold in the wilds of central Mexico. Through enormous difficulties, they eventually succeed in finding gold, but bandits, the elements, and most especially greed threaten to turn their success into disaster.",Two Americans searching for work in Mexico convince an old prospector to help them mine for gold in the Sierra Madre Mountains.,The Treasure of the Sierra Madre,https://www.imdb.com/title/tt0040897/,"John Huston,B. Traven",1948
My Neighbor Totoro,1.66 : 1,3700000,"Noriko Hidaka,Chika Sakamoto,Shigesato Itoi,Sumi Shimamoto,Tanie Kitabayashi,Hitoshi Takagi,Yûko Maruyama,Machiko Washio,Reiko Suzuki,Masashi Hirose,Toshiyuki Amagasa,Shigeru Chiba,Naoki Tatsuta,Tarako,Tomohiro Nishimura",G,Color,Japan,30550727,Hayao Miyazaki,1h 26min,,"Animation,Family,Fantasy",2250213,"sister sister relationship,studio ghibli,sick mother,little girl,father daughter relationship",Japanese,539245,/title/tt0096283/mediaviewer/rm4095130625,8.2,298872,13 July 1990 (USA),Dolby Stereo,"Hitoshi Takagi,Noriko Hidaka,Chika Sakamoto","Two young girls, 10-year-old Satsuki and her 4-year-old sister Mei, move into a house in the country with their father to be closer to their hospitalized mother. Satsuki and Mei discover that the nearby forest is inhabited by magical creatures called Totoros (pronounced toe-toe-ro). They soon befriend these Totoros, and have several magical adventures.","When two girls move to the country to be near their ailing mother, they have adventures with the wondrous forest spirits who live nearby.",My Neighbor Totoro,https://www.imdb.com/title/tt0096283/,Hayao Miyazaki,1988
The Raging Bull,1.85 : 1,18000000,"Robert De Niro,Cathy Moriarty,Joe Pesci,Frank Vincent,Nicholas Colasanto,Theresa Saldana,Mario Gallo,Frank Adonis,Joseph Bono,Frank Topham,Lori Anne Flax,Charles Scorsese,Don Dunphy,Bill Hanrahan,Rita Bennett",R,Black and White,USA,23402427,Martin Scorsese,2h 9min,"Downtown, Los Angeles, California, USA","Biography,Drama,Sport",23383987,"jealousy,rage,domestic violence,violence,boxing",English,128590,/title/tt0081398/mediaviewer/rm3879544320,8.2,326470,19 December 1980 (USA),Dolby Stereo,"Robert De Niro,Cathy Moriarty,Joe Pesci",When,"The life of boxer Jake LaMotta , whose violence and temper that led him to the top in the ring destroyed his life outside of it.",Raging Bull,https://www.imdb.com/title/tt0081398/,"Jake LaMotta,Joseph Carter,3 more credits",1980
"Lock, Stock and Two Smoking Barrels",1.85 : 1,"GBP960,000","Jason Flemyng,Dexter Fletcher,Nick Moran,Jason Statham,Steven Mackintosh,Nicholas Rowe,Nick Marcq,Charles Forbes,Vinnie Jones,Lenny McLean,Peter McNicholl,P.H. Moriarty,Frank Harper,Steve Sweeney,Huggy Leaver",R,Color,UK,3753929,Guy Ritchie,1h 47min,"13-15 Park Street, London, England, UK","Action,Comedy,Crime",3753929,"gangster,dark comedy,violence,united kingdom,shotgun",English,143321,/title/tt0120735/mediaviewer/rm1138956032,8.2,542607,28 August 1998 (UK),Dolby Digital,"Jason Flemyng,Dexter Fletcher,Nick Moran","Four Jack-the-lads find themselves heavily - seriously heavily - in debt to an East End hard man and his enforcers after a crooked card game. Overhearing their neighbours in the next flat plotting to hold up a group of out-of-their-depth drug growers, our heros decide to stitch up the robbers in turn. In a way the confusion really starts when a pair of antique double-barrelled shotguns go missing in a completely different scam.","Eddy persuades his three pals to pool money for a vital poker game against a powerful local mobster, Hatchet Harry. Eddy loses, after which Harry gives him a week to pay back 500,000 pounds.","Lock, Stock and Two Smoking Barrels",https://www.imdb.com/title/tt0120735/,Guy Ritchie,1998
Judgment at Nuremberg,1.85 : 1,3000000,"Spencer Tracy,Burt Lancaster,Richard Widmark,Marlene Dietrich,Maximilian Schell,Judy Garland,Montgomery Clift,William Shatner,Werner Klemperer,Kenneth MacKenna,Torben Meyer,Joseph Bernard,Alan Baxter,Edward Binns,Virginia Christine",Approved,Black and White,USA,12180,Stanley Kramer,2h 59min,"Tower of London, Backlot, Universal Studios - 100 Universal City Plaza, Universal City, California, USA","Drama,War",,"nuremberg trials,nuremberg germany,judge,nazi,war crime",English,,/title/tt0055031/mediaviewer/rm3375268864,8.2,70896,21 December 1961 (Mexico),Mono,"Spencer Tracy,Burt Lancaster,Richard Widmark","It has been three years since the most important Nazi leaders had already been tried. This trial is about 4 judges who used their offices to conduct Nazi sterilization and cleansing policies. Retired American judge, Dan Haywood has a daunting task ahead of him. The Cold War is heating up and no one wants any more trials as Germany, and Allied governments, want to forget the past. But is that the right thing to do is the question that the tribunal must decide.","In 1948, an American court in occupied Germany tries four Nazis judged for war crimes.",Judgment at Nuremberg,https://www.imdb.com/title/tt0055031/,"Abby Mann,Abby Mann",1961
The Secret in Their Eyes,2.35 : 1,2000000,"Soledad Villamil,Ricardo Darín,Carla Quevedo,Pablo Rago,Javier Godino,Bárbara Palladino,Rudy Romano,Alejandro Abelenda,Mario Alarcón,Guillermo Francella,Sebastián Blanco,Mariano Argento,José Luis Gioia,Juan José Ortíz,Kiko Cerone",R,Color,Argentina,35079650,Juan José Campanella,2h 9min,"Estación Retiro, Retiro, Buenos Aires, Federal District, Argentina","Drama,Mystery,Romance,Thriller",6391436,"soccer game,concealed,clandestine,undercover,full frontal female nudity",Spanish,167866,/title/tt1305806/mediaviewer/rm2156706817,8.2,196414,21 May 2010 (USA),Dolby Digital,"Ricardo Darín,Soledad Villamil,Pablo Rago","In 1999, retired Argentinian federal justice agent Benjamín Espósito is writing a novel, using an old closed case as the source material. That case is the brutal rape and murder of Liliana Coloto. In addition to seeing the extreme grief of the victim's husband Ricardo Morales, Benjamín, his assistant Pablo Sandoval, and newly hired department chief Irene Menéndez-Hastings were personally affected by the case as Benjamín and Pablo tracked the killer, hence the reason why the unsatisfactory ending to the case has always bothered him. Despite the department already having two other suspects, Benjamín and Pablo ultimately were certain that a man named Isidoro Gómez is the real killer. Although he is aware that historical accuracy is not paramount for the novel, the process of revisiting the case is more an issue of closure for him. He tries to speak to the key players in the case, most specifically Irene, who still works in the justice department and who he has always been attracted to ...",A retired legal counselor writes a novel hoping to find closure for one of his past unresolved homicide cases and for his unreciprocated love with his superior - both of which still haunt him decades later.,The Secret in Their Eyes,https://www.imdb.com/title/tt1305806/,"Eduardo Sacheri,Juan José Campanella,1 more credit",2009
Oil!,2.39 : 1,25000000,"Daniel Day-Lewis,Martin Stringer,Matthew Braden Stringer,Jacob Stringer,Joseph Mussey,Barry Del Sherman,Harrison Taylor,Stockton Taylor,Paul F. Tompkins,Dillon Freasier,Kevin Breznahan,Jim Meskimen,Erica Sullivan,Randall Carver,Coco Leigh",R,Color,USA,76182388,Paul Thomas Anderson,2h 38min,"Shafter, Texas, USA",Drama,40222514,"oil,misanthrope,loss of hearing,1910s,prospector",English,190739,/title/tt0469494/mediaviewer/rm883920896,8.2,527386,25 January 2008 (USA),SDDS,"Daniel Day-Lewis,Paul Dano,Ciarán Hinds","The intersecting life stories of Daniel Plainview and Eli Sunday in early twentieth century California is presented. Miner turn oilman Daniel Plainview is a driven man who will do whatever it takes to achieve his goals. He works hard but he also takes advantage of those around him at their expense if need be. His business partner is his son H.W., who in reality he ""acquired"" when H.W.'s biological single father, who worked on one of Daniel's rigs, got killed in a workplace accident. Daniel is deeply protective of H.W. if only for what H.W. brings to the partnership. Eli Sunday is one in a pair of twins, whose family farm Daniel purchases for the major oil deposit located on it. Eli, the local preacher and a self-proclaimed faith healer, wants the money from the sale of the property to finance his own church. The lives of the two competitive men often clash as Daniel pumps oil off the property and tries to acquire all the surrounding land at bargain prices to be able to build a ...","A story of family, religion, hatred, oil and madness, focusing on a turn-of-the-century prospector in the early days of the business.",There Will Be Blood,https://www.imdb.com/title/tt0469494/,"Paul Thomas Anderson,Upton Sinclair",2007
Pan's Labyrinth,1.85 : 1,19000000,"Ivana Baquero,Sergi López,Maribel Verdú,Doug Jones,Ariadna Gil,Álex Angulo,Manolo Solo,César Vea,Roger Casamajor,Ivan Massagué,Gonzalo Uriarte,Eusebio Lázaro,Francisco Vidal,Juanjo Cucalón,Lina Mira",R,Color,Mexico,83850267,Guillermo del Toro,1h 58min,Spain,"Drama,Fantasy,War",37634615,"fairy,hiding,woods,maze,spain",Spanish,568641,/title/tt0457430/mediaviewer/rm223187456,8.2,626209,19 January 2007 (USA),DTS,"Ivana Baquero,Ariadna Gil,Sergi López","In 1944 Falangist Spain, a girl, fascinated with fairy-tales, is sent along with her pregnant mother to live with her new stepfather, a ruthless captain of the Spanish army. During the night, she meets a fairy who takes her to an old faun in the center of the labyrinth. He tells her she's a princess, but must prove her royalty by surviving three gruesome tasks. If she fails, she will never prove herself to be the true princess and will never see her real father, the king, again.","In the Falangist Spain of 1944, the bookish young stepdaughter of a sadistic army officer escapes into an eerie but captivating fantasy world.",Pan's Labyrinth,https://www.imdb.com/title/tt0457430/,Guillermo del Toro,2006
The Great Escape,2.35 : 1,4000000,"Steve McQueen,James Garner,Richard Attenborough,James Donald,Charles Bronson,Donald Pleasence,James Coburn,Hannes Messemer,David McCallum,Gordon Jackson,John Leyton,Angus Lennie,Nigel Stock,Robert Graf,Jud Taylor",Approved,Color,USA,228178,John Sturges,2h 52min,"Perlacher Forst, Bavaria, Germany","Adventure,Drama,History,Thriller,War",,"tunnel,escape from prison,escape,prisoner of war,nazi germany",English,,/title/tt0057115/mediaviewer/rm4173733632,8.2,227839,4 July 1963 (USA),4-Track Stereo,"Steve McQueen,James Garner,Richard Attenborough","Based on a true story, a group of allied escape artist-type prisoners-of-war are all put in an ""escape proof"" camp. Their leader decides to try to take out several hundred all at once. The first half of the movie is played for comedy, as the prisoners mostly outwit their jailers to dig the escape tunnel. The second half is high adventure as they use planes, trains, and boats to get out of occupied Europe.",Allied prisoners of war plan for several hundred of their number to escape from a German camp during World War II.,The Great Escape,https://www.imdb.com/title/tt0057115/,"Paul Brickhill,James Clavell,1 more credit",1963
A Beautiful Mind,1.85 : 1,58000000,"Russell Crowe,Ed Harris,Jennifer Connelly,Christopher Plummer,Paul Bettany,Adam Goldberg,Josh Lucas,Anthony Rapp,Jason Gray-Stanford,Judd Hirsch,Austin Pendleton,Vivien Cardone,Jillie Simon,Victor Steinbach,Tanya Clarke",PG-13,Color,USA,316791257,Ron Howard,2h 15min,"Bayonne, New Jersey, USA","Biography,Drama",170742341,"mathematician,mental illness,schizophrenia,nobel prize,game theory",English,367151,/title/tt0268978/mediaviewer/rm3910404352,8.2,861936,4 January 2002 (USA),DTS,"Russell Crowe,Ed Harris,Jennifer Connelly","From the heights of notoriety to the depths of depravity, John Forbes Nash, Jr. experienced it all. A mathematical genius, he made an astonishing discovery early in his career and stood on the brink of international acclaim. But the handsome and arrogant Nash soon found himself on a painful and harrowing journey of self-discovery. After many years of struggle, he eventually triumphed over his tragedy, and finally - late in life - received the Nobel Prize.","After John Nash , a brilliant but asocial mathematician, accepts secret work in cryptography, his life takes a turn for the nightmarish.",A Beautiful Mind,https://www.imdb.com/title/tt0268978/,"Akiva Goldsman,Sylvia Nasar",2001
The Wolf of Wall Street,2.39 : 1,100000000,"Leonardo DiCaprio,Jonah Hill,Margot Robbie,Matthew McConaughey,Kyle Chandler,Rob Reiner,Jon Bernthal,Jon Favreau,Jean Dujardin,Joanna Lumley,Cristin Milioti,Christine Ebersole,Shea Whigham,Katarina Cas,P.J. Byrne",R,Color,USA,392000694,Martin Scorsese,3h,"New York City, New York, USA","Biography,Crime,Drama",116900694,"based on true story,stockbroker,topless female nudity,fellatio,sex in an airplane",English,18361578,/title/tt0993846/mediaviewer/rm2842940160,8.2,1217741,25 December 2013 (USA),Datasat,"Leonardo DiCaprio,Jonah Hill,Margot Robbie","In the early 1990s, Jordan Belfort teamed with his partner Donny Azoff and started brokerage firm Stratton Oakmont. Their company quickly grows from a staff of 20 to a staff of more than 250 and their status in the trading community and Wall Street grows exponentially. So much that companies file their initial public offerings through them. As their status grows, so do the amount of substances they abuse, and so do their lies. They draw attention like no other, throwing lavish parties for their staff when they hit the jackpot on high trades. That ultimately leads to Belfort featured on the cover of Forbes Magazine, being called ""The Wolf Of Wall St."". With the FBI onto Belfort's trading schemes, he devises new ways to cover his tracks and watch his fortune grow. Belfort ultimately comes up with a scheme to stash their cash in a European bank. But with the FBI watching him like a hawk, how long will Belfort and Azoff be able to maintain their elaborate wealth and luxurious lifestyles?","Based on the true story of Jordan Belfort , from his rise to a wealthy stock-broker living the high life to his fall involving crime, corruption and the federal government.",The Wolf of Wall Street,https://www.imdb.com/title/tt0993846/,"Terence Winter,Jordan Belfort",2013
Casino,2.39 : 1,52000000,"Robert De Niro,Sharon Stone,Joe Pesci,James Woods,Don Rickles,Alan King,Kevin Pollak,L.Q. Jones,Dick Smothers,Frank Vincent,John Bloom,Pasquale Cajano,Melissa Prophet,Bill Allison,Vinny Vella",R,Color,USA,116112375,Martin Scorsese,2h 58min,"The Peppermill Fireside Lounge, Las Vegas, Nevada, USA","Crime,Drama",42512375,"crime epic,casino,gambling,gangster,exploding car",English,9946480,/title/tt0112641/mediaviewer/rm3748798208,8.2,474508,22 November 1995 (USA),DTS-Stereo,"Robert De Niro,Sharon Stone,Joe Pesci","This Martin Scorsese film depicts the Janus-like quality of Las Vegas--it has a glittering, glamorous face, as well as a brutal, cruel one. Ace Rothstein and Nicky Santoro, mobsters who move to Las Vegas to make their mark, live and work in this paradoxical world. Seen through their eyes, each as a foil to the other, the details of mob involvement in the casinos of the 1970s and '80s are revealed. Ace is the smooth operator of the Tangiers casino, while Nicky is his boyhood friend and tough strongman, robbing and shaking down the locals. However, they each have a tragic flaw--Ace falls in love with a hustler, Ginger, and Nicky falls into an ever-deepening spiral of drugs and violence.","A tale of greed, deception, money, power, and murder occur between two best friends: a mafia enforcer and a casino executive compete against each other over a gambling empire, and over a fast-living and fast-loving socialite.",Casino,https://www.imdb.com/title/tt0112641/,"Nicholas Pileggi,Nicholas Pileggi,1 more credit",1995
